,Unnamed: 0,催收外呼id,客户号,渠道,外呼时间,联系结果,通话录音,collection_result,call_seconds,火山asr,错误点,科大翻译,错误点,阿里云asr,错误点,,"Mal redactado, incoherente"
0,0,1.04e+18,8E+11,0,2025/12/16 16:42,11,https://nxai-hk-1259196162.cos.ap-hongkong.myqcloud.com/20251217/25523/56b271c4-afaa-486f-82e2-7f07ef995ddb.mp3,有还款诚意,154,2,,"通道1: Bueno, sí, sí, sí, así. Sí, ahorita, estoy buscando a ver si alguien me ayuda a hacer la transferencia. O se puede pagar en alguna otra, en ox o en bodega. No, aquí donde vivo ahí, este ahorra y oxo. No, aquí donde vivo ahí, este ahorra y oxo. Sí, sí. Sí, si gusta, me pueden agregar 1-al guazaz y ya yo ahí le mando foto. El efecto, sí, sí está bien. Gracias. 2.- De después es sol En el que puedo hacer nuestra piel. No se escucha bien. Sí. Gracias por ver. Gracias por ver mentiras. Gracias.
通道2: Bueno, buenas tardes, tengo el gusto con el regnijo de Sanchez en el ena. Mucho gusto, señorita, habla su asesor financiero 4.- de Olazina, el motivo de la llamada es para recordarle que tiene un pago vencido de 400 pesos. Y se 5.- le decimos que lo pagan ya de hoy para que no es que 6.- le tendrían un cofre de crapo de raso. ¿Te puede realizar dentro de su barcallón? Ah, muy bien, señorita.7.-  Eso como cualquier pucero de empago. Así es, señor, 8.-tú se puede pagar 9.- en un ojo pero así no se 10 .- ve ni leve o también 11,. en parmasias del hue de la cara o no horrorar a comisión o también en walmas. Estamos bien, señorita, nos regra, se puede... Le vemos un momento que detectos eléfo, ¿no? En el cual hay un nín para que pueda acceder a la niña del pago. Ahí metemos un nombre y el muerto te va a pagar y difícil es en efectivo o con razón en 12.- su acarición. Ya nada más le da clic ahí en efectivo y en el 13.-  helico de barra y los traducimientos y entonces puede para realizar su pago. 14 .- ¿Recordar? Si las miren el ciudad, como nuevamente de invía, el mensaje detecto no se lo puede 15.- checar y me confirma si ya le llegó. ¿Qué tal vamos? Muy bien, señor, que le agradezco por 16.- estarla llamada como un cuento tiempo que las pago disculpe. 17.- ¿No? ¿No? ¿No? ¿Como un cuento tiempo que daría realizado el pago? Ahí metemos mucho mejor. El cuento tiempo que daría el pago, señorita Sancho. Muy bien, señorita. 18.- Le agradezco por compromense por estarla llamada que posible ni. ¡Sí!
","1-al guazaz  2.- De después es sol En el que puedo hacer nuestra piel. No se escucha bien. Sí. Gracias por ver. Gracias por ver mentiras. Gracias.
通道2: Bueno, buenas tardes, tengo el gusto con el regnijo de Sanchez en el ena. Mucho gusto, señorita, habla su asesor financiero 4.- de Olazina, el motivo de la llamada es para recordarle que tiene un pago vencido de 400 pesos. Y se 5.- le decimos que lo pagan ya de hoy e 6.- le tendrían un cofre de crapo de raso. ¿Te puede realizar dentro de su barcallón? Ah, muy bien, señorita.7.-  Eso como cualquier pucero de empago. Así es, señor, 8.-tú se puede pagar 9.- en un ojo pero así no se 10 .- ve ni leve o también 11,. en parmasias del hue de la cara o no horrorar a comisión o también en walmas. Estamos bien, señorita, nos regra, se puede... Le vemos un momento que detectos eléfo, ¿no? En el cual hay un nín para que pueda acceder a la niña del pago. Ahí metemos un nombre y el muerto te va a pagar y difícil es en efectivo o con razón en 12.- su acarición. Ya nada más le da clic ahí en efectivo y en el 13.-  helico de barra y los traducimientos y entonces puede para realizar su pago. 14 .- ¿Recordar? Si las miren el ciudad, como nuevamente de invía, el mensaje detecto no se lo puede 15.- checar y me confirma si ya le llegó. ¿Qué tal vamos? Muy bien, señor, que le agradezco por 16.- estarla llamada como un cuento tiempo que las pago disculpe. 17.- ¿No? ¿No? ¿No? ¿Como un cuento tiempo que daría realizado el pago? Ahí metemos mucho mejor. El cuento tiempo que daría el pago, señorita Sancho. Muy bien, señorita. 18.- Le agradezco por compromense por estarla llamada que posible ni. ¡Sí!
","{'channel_0': 'Bueno. Sí, sí, así es. Sí, ahorita estoy buscando a ver si alguien me ayuda a hacer la transferencia. o se puede pagar este en alguna otra. En oxxo o en bodega. No, aquí donde estoy, donde vivo, hay este aurrera y oso. Sí. Si gusta, me pueden agregar al WhatsApp y ya yo ahí le mando fotos. Perfecto. Sí, sí está bien. Gracias. ¿Qué cosa puede hacer esta ferencia? no se escucha bien. sí. Este, ¿antes de la seis por favor? Gracias igualmente. Gracias. '},{'channel_1': '¿Qué es lo que más te ha gustado de la película? A mucha gente le encanta el chocolate, pero no a todos. Sí, solicitamos que lo paguen ya de hoy para que no se le enderegue un cobro extra por atraso. ¿Lo puede realizar en la oficina bancaria? Ahh, muy bien, señorita. Eso como en cuánto tiempo queda el pago? Así es, señora, se puede pagar en no en Oxxo, pero sí en un Seven-Eleven o también en farmacias Guadalajara o en la tienda como mencionas, o también en Walmart. Ah, muy bien, señor. Nos regalase puede. Le enviamos un mensaje de texto a su teléfono en el cual hay un link para que pueda acceder a la liga del pago. Ahí menciona su nombre y el monto que va a pagar, y dice si es en efectivo o con transferencia bancaria. Ya nada más le da clic ahí en efectivo y en el código de barras y los establecimientos donde puede realizar su pago. Recuerda. me decía el daniel cómo nuevamente de enviar el mensaje detecto, no sé si lo puede checar y me confirma si ya le llegó. Muy bien, señorita, le agradezco por contestar la llamada. ¿Cómo encuentro tiempo? ¿Queda el pago de este? ¿Cuánto tiempo quedaría realizado el pago? ¿Alguien me explica mejor? ¿Cómo en cuánto tiempo quedaría el juego, señorita Sánchez? Muy bien, señorita. Le agradezco por su compromiso para contestar la llamada que pasó el viernes. chico. '}",que es lo que mas te ha gustado de la pelicula 这个部分在语音听错了,,Palabra inventada
1,1,1.04e+18,8E+11,3,2025/12/16 9:47,15,https://pcc-va.airudder.com/download/20251216/c402cfdf8ab24347b7b04aa53d38412c/b465e58673cc4d17856b5a0d17c72ee3.wav,无还款诚意,149,"[['¿No tengo 130 y 5 6 6?', '1'], ['Ah, sí, ¡sí que lo haces en el mando llamando a la lupa 6 6 9!', '1']]",根据录音 ，这句话没有逻辑而且也不符合,"通道1: WikiTube
通道2: La gente que nos ha creado un poquito, la que nos ha creado un poco. No, chiquéis, no. No, no, no, tampoco. ¿No? ¿No? ¿No? ¿No? ¿No? ¿No? ¿No? ¿No? ¿No? ¿No, no? ¿No? ¿No? ¿No? ¿No? ¿Pase? ¿No? ¿No? ¿No? ¿No? ¿No? ¿Dienes ni concohento? Damit 95 держjan piercing y y y y y y y y y y y y y y y y y y y y y y y y y y y y y y y y y y y y y y y y
","estoy buscando a ver si alguien me ayuda hacer la trasnferencia , se puede pagar en oxxo ","{'channel_0': nan},{'channel_1': 'agregar un juego, agregar un juego. Una pregunta, ¿cómo? no tampoco. ¿cuánto? ¿Y qué. estuve en filipinas por dentro. Espero. ah, sí. ya la preño. '}",saldo pendiente de 154 centavos,,Monto absurdo (centavos en lugar de pesos)
2,2,1.04e+18,8E+11,3,2025/12/16 15:10,17,https://pcc-va.airudder.com/download/20251216/c402cfdf8ab24347b7b04aa53d38412c/b465e58673cc4d17856b5a0d17c72ee3.wav,无法沟通,144,[],,"通道1: Bueno. Bueno. Bueno. Bueno. Bueno. Bueno. Bueno. Bueno. Bueno. Bueno. Bueno. Bueno. Bueno. Bueno. Bueno. Bueno. Bueno. Bueno. Bueno. Bueno. Bueno. Bueno. Bueno. Bueno. Bueno. Bueno.
通道2: y y y y y y y y y y y y y y y y y y y y y y y y y y y y y y y y y y y y y de la gente. Omín, sí, por favor, déjelo al mensaje que es mi confinero. ¿Dónde? Muy bien. ¿Cuáles es un posto central? Muy bien. Perfecto. Taren espera de su exposición. Una fina. Una fina. O la fina. Está alo mencion сред al crease. Bueno. El calomato, bueno, tú formas, bueno, í鼖 этой. Els calomones, pronouncem de la ook miemosa del守.תuñas, nosotros podemos aggregate. Podrías confiscarte, bueno, los calios recados y los committed. Vamos gustar el deporte hay cuatro cipusas. Sarlo Tampoco ahora.
","根据录音正确都是对的
Bueno. 

Hola, ¿qué tal? Buena tarde. Eh, se encontrará a Lorenzo de Jesús Paul Smith. 

Bueno. 

Sí, buena tarde. Sí, queremos comunicarnos con Lorenzo de Jesús Paul Smith. Sí, le estoy comunicando de la financiera Holafina. ¿Es usted familiar? 

Bueno. 

¿Es usted familiar de Lorenzo de Jesús? 
Em... Mande. 

Mira, en este caso, podría informarle a Lorenzo de Jesús que, bueno, por el momento presenta un pago pendiente de cuatrocientos ochenta y seis pesos. Parece muy importante que lo realice más tardar el día de hoy antes de las cinco de la tarde. Sí, ya le envié lo que es un mensaje donde aparece su línea de pago para que lo haga por transferencia y código para que pase a una tienda y le eche su pago. 

¿Qué tiene que pagar? 

De su préstamo Holafina. 

¿Su préstamo? 

Sí, correcto. Son cuatrocientos ochenta y seis pesos. Más tardar el día de hoy. 

¿Y de, de qué préstamo o qué? 

Sí, de la financiera Holafina. 
Ah, ¿su nombre de él lo sacó? 
Lo sacó este número telefónico, es por eso que nos estamos comunicando. ¿Es usted familiar o conocida? 
Conocida. 
Ah, muy bien. Sí, por favor, este, déjele el mensaje que es muy importante que lo realice antes de las cinco de la tarde, por favor. ¿Sí? 
¿Cuánto tiene que pagar? 
Cuatrocientos ochenta y seis. 
Ah, bueno, ok. 


Muy bien, perfecto. Estaré en espera de su respuesta. 
¿Qué financiera es?
Holafina. 
¿Cuál? 
Holafina. Deja lo menciono, no hay de qué. 
Ah, ya. Okey, ¿y cuánto le dieron? ¿Cuánto le dieron? 
O sea, al momento, bueno, esta información es muy-- es muy importante que se la envíe a su entidad de crédito, entonces se la podemos volver a ofrecer. ¿Sí? Voy a ir, este, indicarle, bueno, que-- bueno, déjale el recado que realice el pago de cuatrocientos ochenta y seis pesos, por favor. 
Ah, ok, gracias. 
¿Sí? Bueno, hasta luego","{'channel_0': 'bueno. hola. bueno. ¿mamá? ¿qué tiene que pagar? su préstamo. y de, de qué prestamo o qué. ah, su nombre de él lo sacó. conocida. ¿Cuánto cuánto se necesita para. Ah, bueno, ok. ¿Qué financiera es? ¿qué? ah yeah. ok,¿y cuánto le dieron? ¿cuánto le dieron? ah, okay, gracias. '},{'channel_1': 'Buenas tardes, se apuntará Lorenzo Ma de Jesús Paul Ruiz. Sí, buenas tardes. Sí, queremos comunicarnos con Lorenzo Ma de Jesús Paul Ruiz. Sí, me estoy comunicando de la comisaría Olafina. Sí, eso es tres familiares. ¿Es usted familiar de Lorenzo de Jesús? Mira, en este caso, por favor, le agradezco que bueno, por el momento, presenta pago para este de 486 pesos. ¿Cuál es muy importante que lo realice más tarde el día de hoy antes de las 5 de la tarde? Sí, ya le envió lo que es un mensaje donde aparece su línea de pago para que lo haga por transferencia y código para que pase a una página de su pago. son cuatrocientos. más tarde el día de. si de la financiera o la fina. nos acostumbra el número telefónico, por eso que nos estamos comunicando. es usted familiar o conocida. O bien, sí, mi esposo, déjale el mensaje que es muy importante. cuatrocientos ochenta y seis. Muy bien, perfecto. Estaré en espera de su depósito. Gracias por la fina. o la fina. Bueno. la calabaza, bueno, esta información es muy importante que se la brindemos a la comunidad de frito, pues se la podemos brindar en cero, sí, podría estimularle, bueno, que. Bueno, déjale el recado que realice el pago de cuatrocientos ochenta y seis pesos. '}","y con quine me puedo comunicar ,  si podria por favor llamarme ",,Frase cortada
3,3,1.04e+18,8E+11,0,2025/12/16 11:03,15,https://pcc-va.airudder.com/download/20251216/c402cfdf8ab24347b7b04aa53d38412c/b465e58673cc4d17856b5a0d17c72ee3.wav,无还款诚意,143,"[['Hola, ¿qué Tal?', '1'], ['6 9, 9 9 4 eso hay que darlo rebajado, ¿no? No 10 0 no, no me deja decir.', '1'], ['Buenos días señor Víctor, a usted le pido su contacto de emergencia ya que el señor Ricardo no nos ha contactado.', '2'], ['Señor Víctor, por favor, cuánto usted VA a pagar de la deuda del señor, ya que usted ha quedado y él ha dicho que usted VA a pagar.', '3'], ['¡3 5 5 ah!', '1'], ['9 señor Víctor, ¡buenas tardes!', '1'], ['0.', '1'], ['Señor Víctor, mire, le comento, si usted no paga la deuda de su hermano, se le estará marcará, se lo estará marcando 24 7 que realice el pago correspondiente.', '3'], ['Necesito que realice su pago antes de las 12 del día, ya que el señor dijo que usted VA a pagar su deuda 0.', '2']]",根据录音，这句话没有逻辑而且也不符合,"通道1: Este empiece watery al flights, esta90k para el departamento e trajer Maconiano. y y y y y y y y y y y y y y y y y y y y y y y y y y y y y y y y y y y y y y y y y y y y y y y y y y y y y y y y y y y y
通道2: ¿A usted se hace un contacto de medicina? Ya que se lleno de carne, no se ha contactado. Señor Víctor, por favor se se habla más cuando usted. Para que se poniste por favor de la deucro de señor, ya que usted la ha quedado y él ha dicho que a usted va a pagar. ¿Esta es carbista? Yo te he quedado y te he quedado y escuché sus televisores. ¿Te he escuchado? Comitan necesito carregir pago de mil. ¿Te he pensado? ¿Te he pensado que se te va a ser antes de la una de las dos de las dos de la niña? ¿Te he pensado que va a pagar? ¿Me he escuchado? ¿Te he venido su pago? Señor Víctor. Señor Víctor. Señor Víctor, yo sé que me escuchaba. Señor Víctor. Señor Víctor, ¿molestarles? ¿Venir a la deucro de señor? Señor Víctor, me deé de comentarios y usted no te apaga la deuda de su hermano. Señor Víctor, me deé de comer los childish, ¿cente apaga la deuda de su hermano? Se lo será más que hasta 24 childish que se que lo dice para correspondiente. Estos que lo dijiste pago antes de las dos de la niña. Ya que peño, déjgo que usted va a pagar su deuda.
","根据录音正确都是对的Hola, ¿qué tal? Buenos días, señor Víctor. 

Señor Víctor, buenas tardes. Buenos días (pausa de dos segundos). Señor Víctor, está buscando al señor Oaxaca Huertas Ricardo. Mire, señor Ví-- le enviamos una carta el diez de junio. Y en esa carta le pedimos su número de teléfono y su código postal, a usted se le olvidó su contacto de emergencia. Ya que el señor Vi-- Ricardo no nos ha contactado, señor Víctor, por favor, le estamos llamando cuando usted para que realice el pago de la deuda del señor, ya que usted ha quedado y él ha dicho que usted va a pagarla (pausa de cuatro segundos). Señor Víctor (pausa de cuatro segundos). 

¿Quiere ver el otro? 


Señor Víctor, como yo no soy su televisor y escuché ruido... Comienzo. Necesito que realice el pago de mil trescientos cuarenta y cinco centavos antes de la una, antes de las dos del día. Si no, va a pagar, necesito que realice su pago. 

Sí, no, vale. 


Señor Rica-- Señor Víctor (pausa de cuatro segundos). Señor Víctor, yo sé que me escucha. 





Señor Víctor (pausa de seis segundos). Señor Víctor, buenas tardes. 


Si se puede, joven. Okey. Claro (pausa de cuatro segundos). Mira, aquí tienes. 


Señor Víctor, mire, le comento, si usted no paga la deuda de su hermano, se estará máscara-- se le estará marcando veinticuatro litros hasta que realice el pago correspondiente. Necesito que realice su pago antes de las doce del día. Ya que el señor dijo que usted va a pagar su deuda. 


Sí. Sí, claro, pues usted elija.","{'channel_0': 'Diseña de este mientras. I need to. Quiere ver el otro? Gracias. Entiendo que la logística. Okay, well. ¿Cómo le. Si, claro. '},{'channel_1': 'hola qué tal, buenos días señor rita. Señor Víctor Bonastre, ¿cómo está? Señor Richard, ¿está buscando al señor Oaxaca Huerta Ricardo? Mire, señor Richard, tenemos que ver una cantidad de 1000. A ustedes, por favor, su contacto de emergencia. Ya que se le dio a Ricardo, no se ha contactado, señor Víctor. Por favor, se está llamando con usted para que le dé el pago de la deuda del señor, ya que usted ha quedado y él ha dicho que usted va a pagar. Thank you very. ¿Qué me escucha? Escuché en el editor y escuché ruido. Comisión, necesito que realice un pago de 1.550 centavos antes de la una de la tarde, antes de las dos del día. Señora Rica. Señor Víctor, dice que me escuchó. Señor Victor. Señor Ríctor, buenas tardes. Sí, el Víctor Miller le comenta: si usted no paga la deuda de su hermano, se le estará marcando 24. Si usted no realiza el pago correspondiente, necesita que realice su pago antes de las 12 del día. Ya que el señor dijo que usted va a pagar sus deudas. '}",1./ transferencia  principal,,Error de transcripción (“referencia”)
4,4,1.04e+18,8E+11,3,2025/12/16 12:02,17,https://pcc-va.airudder.com/download/manual/f974db3640ac6a0e20badc04f698f04f.wav,无法沟通,140,jm,根据录音，这句话没有逻辑而且也不符合,"通道1: Bueno. ¿A vos te? De hecho, yo le dije que vi a llena en aplicación. ¿Por qué? Para hacer esta experiencia, me van a que me pide una referencia de banco. No. Ok. Y en... ¿Entrapar más de ellos, o puede hacer también, ¿verdad? Y no. Y Y Y Y Y Y Y Y Y Y Y Y Y Y Y Y Y Y Y Y Y Y Y Y Y
通道2: Hola, buenas tardes, señor Yona, también está ahí. Gracias por tomar a llamar a me presento. Soy a sesora de la financiera o la final. Este es un raccolatorio de Pago por 410 pesos. Para el día de hoy. ¿Cómo lo estaría haciendo, señor? En transferencia o en efectivo? Dígame. Sí. Claro, una clave. Yo le voy a mandar la clave en el bancario por WhatsApp y por mi mensaje para que usted tenga los datos. Si se le complica hacerlo por transferencia, lo pueden hacer a través de un pago en efectivo como el código de vagas. Ya sea un 7 y 9. En el año enca destina. Una bodeca o verá, Walmart o en farmacias de la hora o super farmacias. Como usted se le haga más fácil. Si, no puede ser en farmacias de la hora, yo lo voy a mandar un código de vagas. Abajo del código de vagas, tienen los establecimientos donde se lo puede realizar, ven este vengileven, farmacias de la hogar, con el gaujera, de comento. El código de vagas es importante que lo tenga porque lo pasan por los escaleras, lo pasan por el gaujera. Abarato que tienen que irse en la caja de citadora, ahí abajo en la misita y ahí están el código de vagas y ya usted puede pagar el código. Entonces ya su compromiso pago, para el día de hoy son las 12 de mediodía. Tendremos su pago máximo en unos 20 minutos. Una hora más tardada. A la hora de la comida no te la tarda que le parece. Ah, pero entonces, si es un higiene, no lo va a tener este higiene, lo va a tener este higiene. Bueno, gracias por estar en la paga. Yo lo voy a mandar el código, por favor, cheque y WhatsApp y cheque. Su es el desayudio de teléfono, ¿no lo agradezco? O sea, más tienes una media de acuerdo. El pago es de 410 pesos en día, todo en formación. Que tenga excelencia, ¿estábamos? A usted, buen día.
","根据录音正确都是对的Bueno? 
Hola, buena tarde. Señor Jonathan, ¿está ahí? Gracias por tomar la llamada. Me presento, soy asesora de la financiera Hola Fina. Este es un recordatorio de pago por cuatrocientos diez pesos para el día de hoy. ¿Cómo lo estaría haciendo, señor? ¿En transferencia oooh en efectivo? 
Oiga, eh. De hecho, yo, yo le escribí ahí en aaa, en la aplicación. Porque, eh, para hacer la transferencia necesi-- eh, mi banca me, me pide una referencia de banco. 
Claro, una clave. Yo le voy a mandar la clave interbancaria poooos WhatsApp y por mensaje para que usted tenga los datos. Si se le complica hacerlo por transferencia, lo puede hacer a través de un pago en efectivo con el código de barras, ya sea en un Seven-Eleven. De Seven-Eleven hay uno en cada esquina, una Bodega Aurrerá, Walmart o en Farmacias del Ahorro, Superfarmacias, como a usted se le haga más fácil. 

Okey, , en tu farmacia de oro puede ser también, ¿verdad? 

Sí, lo puede hacer en Farmacias del Ahorro. Yo le voy a mandar un código de barras. Abajo del código de barras viene laaa, vienen los establecimientos donde usted lo puede realizar. Ahí viene Seven-Eleven, Farmacias del Ahorro, Bodega Aurrerá. Le comento, el código de barras es importante que lo tenga porque lo pasan por, lo escanean, lo pasan por el aparato que tienen ellos ahí en la caja registradora, ahí abajo en la mesita y ahí escanean el código de barras y ya usted puede pagar-- hacer el depósito. 
Okey. 
Entonces, ya su compromiso de pago para el día de hoy son las doce del mediodía. Eh, tendremos su pago máximo en unos treinta minutos. Una hora, más tardar. 
Será más, será más, porque estoy, eh, estoy trabajando todavía. Este... 
A la hora de la comida, dos de la tarde, ¿qué le parece? 
Como a las tres, oiga, para no fallarle, ¿sale? 
No lo va a hacer en seco transferencia, lo va a tener que hacer sola, ¿no? Bueno, a las tres de la tarde, ¿está bien? 
Okey, sí, ya lo sé, pero me mande código, ¿sale? 
Yo le voy a mandar el código. Por favor, cheque el WhatsApp y cheque su, su, este, sus mensajitos ahí del teléfono. Le agradezco, señor Martínez. El pago es de cuatrocientos diez pesos. Le envío información. Que tenga excelente día. Hasta luego. 
Igualmente. Gracias. 
A usted. Buen día.","{'channel_0': 'bueno. ¿Aos? De hecho, yo les escribí ahí en la aplicación. porque eh, para hacer transferencias necesi eh mi banco me me pide una referencia de banco. no. ok y en la farmacia también puede ser también, ¿verdad? haha. Okay. No, oiga, se llama más porque estoy trabajando todavía. como las tres oigan para no andarle, no fallan le salen. ok, sí, y lo que sea, pero me mande código sale. ok. igualmente, gracias. '},{'channel_1': 'hola buenas tardes señor jonathan gracias por tomar la llamada me presento soy asesora de la financiera aula final este es un recordatorio de pago por cuatrocientos diez pesos para el día de hoy cómo lo estaría haciendo señores en transferencia o en efectivo. dígame. Claro, una clave. Yo le voy a mandar la clave interbancaria por WhatsApp y por mensaje para que usted tenga los datos. Si se le complica hacerlo por transferencia, lo puede hacer a través de un pago en efectivo como el código de barras, ya sea en un 7-Eleven. Pero de 7-Eleven hay una en cada esquina: una bodega Obrero, Walmart o en farmacias del Oro, superfarmacias. Como usted se le haga más fácil. Sí, lo puede hacer en farmacias del ahorro. Yo le voy a mandar un código de barras. Abajo del código de barras viene la, tienen los establecimientos donde usted lo puede realizar. Ahí viene Seven Eleven, farmacias del ahorro, Codelga o que da. Le comento: el código de barras es importante que lo tenga porque lo pasan por, lo escanean, lo pasan por el aparato que tienen ellos ahí en la caja registradora, ahí abajo en la mesita y ahí escanean el código de barras y ya usted puede hacer el. Entonces, ya su compromiso de pago para el día de hoy son las doce de mediodía. Tendremos su pago a un máximo en unos treinta minutos. una hora más tarde. A la hora de la comida, dos de la tarde. ¿Qué les parece? perdón. Yo le voy a mandar el código, por favor. Cheque WhatsApp y cheques su este sus menajitos ahí del teléfono. No le agradezco, señor Martínez. Nada más le recuerdo: el pago es de cuatrocientos diez pesos. Le envío todo información. Que tenga excelente día. Hasta luego. A ustedes buen día. '}",1./me puede decir por favor como abrio la aplicacion _/ hola fina ,,“esco” no tiene sentido
