,Unnamed: 0,催收外呼id,客户号,渠道,外呼时间,联系结果,通话录音,collection_result,call_seconds,火山asr,错误点,科大翻译,错误点,阿里云asr,错误点,,"Mal redactado, incoherente"
14,14,1.04e+18,8E+11,0,2025/12/16 17:39,20,https://nxai-hk-1259196162.cos.ap-hongkong.myqcloud.com/20251217/25523/5ecddda6-ae42-48b8-a40c-520f1df83fef.mp3,称不认识,120,"[['Bueno, buenas tardes, estoy buscando a Brisa Guadalupe borcelín Guzmán, somos de Olavarría, estoy buscando a Brisa Guadalupe borcelín Guzmán, somos de Olavarría, para que pague lo que debe, sí, no, de hecho, ¿Ella la dejó usted como aval de esta deuda en este caso?', '1'], ['5 perdón ya no, yo no, yo no, ¡si no me lo saco yo no, yo no.', '1'], ['Pues si Ella no nos contesta la tenemos que contactar a usted para recuperar los 1 132.50 que nos debe.', '1'], ['Pero pues yo, la verdad, yo no sé ni quién es esa persona, oiga, de hecho me Han estado marca, me me Han estado, me Han estado, me Han mandado mensajes y yo ya les dije que yo ya no la no la conozco ya igual es si me dejó a mí de si me dejó a mí de aval.', '1'], ['Sí la conoce, sí la conoce porque Ella dijo que sí.', '1'], ['¿No?', '1'], ['Pues si la conoce porque Ella dejó su número hoy.', '1'], ['Pues eh, no, eso no importa, eso no importa aunque usted no haya firmado Ella y la dejó como aval de esta deuda.', '1'], ['O sea, yo no firmé nada, yo no di mi nombre, ni supe ni de préstamo ni de nada, ¿no?', '1'], ['Entonces, al no contestarnos Ella, necesitamos a contactarnos con usted para que nos pague lo que lo que se debe de hecho, pues básicamente si pagan los 1 172.50 ahorita ya sin problema se se termina el adeudo y puede seguir pidiendo dinero.', '2'], ['¿0?', '1'], ['Ah, pero igual este, como le dije la otra vez a su compañera, dígame cuál de dónde vive esa mujer, ¿esa persona para yo poderme comunicar con Ella o dónde vive, ¿o de dónde?', '1'], ['Sí usted también le puedo mandar su número, pero básicamente el domicilio lo lo tiene que conocer, tiene que ser por eh tipo y acá sí le puedo Dar el domicilio, le puedo Dar el domicilio.', '1'], ['Pero Ella, esa persona, ¿qué domicilio tiene para yo poder acudir a su casa de Ella?', '2'], ['Pero es que si usted está haciendo 1 préstamo, tiene que tener el domicilio de la persona de dónde se los está pidiendo.', '2']]",录音上没有这个录音,"通道1: ¿Perdón? Ah, no, esto no es un número, está silbocado. Ah, no, esto no es un número, está silbocado. Pero pues yo, la verdad, yo no sé ni tienes esa persona, no dirá. De hecho, me ha estado marcar, me ha estado en un mensaje, si yo no lo lo conozco. Si me dejó a mi, si me dejó a mi de abar los ayuno, firme nada, yo no dime nombre ni su vida, es propuesta monide nada. Pero... Ah, para igual, como le dije a los travesas de compañeras, y digamos dónde vive esa mujer, esa persona para yo podemos comunicar con ella. ¿Cómo? ¿Qué video? ¿De dónde? Pero ella, esa persona que a domicil lo tiene para yo poder a su vida, a tu casa de ella. Pero si ustedes hacen un prestando, tienes que tener el domicilio de la persona de dónde se nos está pidiendo.
通道2: Bueno, bueno a estar bien, ustedes gustan la brisa Guadalupe, por ser Inguis Man, como de la Viva, estoy buscando la brisa Guadalupe, por ser Inguis Man, como de la Viva, para que pague lo que debe. Si no me he hecho ella, la dejó que como a Val de Euda, en este caso, pues llegan a los contestas, la tenemos que contactar ustedes para esperar los 1.532.50 que nos le ven. Y la conoce, si la conoce, porque ya es tu frisa. Vamos a ir la conoce, porque ya dejo un un show, es de... No es un importante, eso no es importante, esto no haya firmado ella y la dejó como a Val de Euda. Entonces, a lo que estamos ellas, nos estamos contactando con ustedes para que nos pague lo que se debe. De hecho, básicamente para los 1.532, que en cuenta ahorita ya sin problemas se termina el adeudo y puede seguir pidiendo dinero. Quizás nombreuxils en los unos grados. Jef narrow. H precursión, creo. Pero solamente los bienvenidos para la conoce, porque hay cisco y approaches, Est minutos ha salido el Fleisch. A él estabaißtas τhead 1.
","Sí, buenas tardes Buenas tardes, estoy buscando a Brissa Guadalupe Borsellín Guzmán Estoy buscando a Brissa Guadalupe Borsellín Guzmán, somos de Olafina para que pague lo que debe.
Ah, no, ese no, ese no es su número, está equivocado.
Si, no, de hecho ella la dejó usted como aval de esta deuda En este caso, porque ella no nos contesta, las tenemos que contactar a usted para recuperar los 1132.50 que nos pero pues yo.
La verdad, yo no sé ni quién es esa persona.
Oiga, de hecho me.
Han estado marcando, me han estado, me han estado mandando un mensaje si yo les dije que yo ya no la no.
La conozco, cuál es si me dejó a mi?
Sí, me dejó a mí de aval, o sea, yo no firme nada, yo no di mi nombre, ni supe ni préstamo ni de nada.
No, eso no importa, eso no importa, aunque usted no haya firmado, ella se la dejó como aval de esta deuda. Entonces, si no contestamos ella necesitamos contactarnos con usted para que nos pague lo que se debe. De hecho, pues básicamente si pagan los 1162.50 ahorita ya sin problemas se termina el adeudo y por eso yo pidiendo dinero.
Pero igual, este, como le dije la otra vez a su compañera, dígame cual de dónde vive esa mujer en esa persona para yo poderme comunicar con ella, pero esa persona que domicilio tiene para yo poder acudir a su casa de ella. Pero es que si usted está haciendo un préstamo, tiene que tener el domicilio de la persona de donde se los está pidiendo.
¿Le puedo dar el domicilio? ¿Le puedo dar el domicilio?  ，正确都是个根本录音
¿Bueno? ","{'channel_0': '¿Cuál es el por. Claro, eso no es su número. Estás equivocado. Pero pues yo, la verdad, yo no sé ni quién es esa persona, diga. De hecho, me ha estado mandando mensajes y ya le dije que yo ya no la conozco. O sea, igual es si me dejó a mí. Si me dejó a mí de aval, o sea, yo no firmé nada, yo no di mi nombre ni supe del préstamo ni de nada. Pero. Ah, pero igual, este como le dije la otra vez a su compañera, y digame de dónde vive esa mujer, esa persona para yo poderme comunicar con ella. ¿De dónde vive? ¿De dónde es? Pero ella, esa persona que domicilio tiene para yo poder ascender a su casa de ella. Pero es que si usted está haciendo un préstamo, tiene que tener el domicilio de la persona de donde se lo está pidiendo. '},{'channel_1': 'bueno. Buenas tardes, estoy buscando a Brisa Guadalupe Bocellín Gómez. Somos de Olapina. Estoy buscando a Brisa Guadalupe Borsellino, es mi hermano. Somos de Olapina para que pague lo que debe. Si no, de hecho, ella la dejó usted como aval de esta deuda. En este caso, pues, ella no nos contesta, las tenemos que contactar a usted para recuperar los 132.50 que nos debe. Si la conoce, si la conoce porque ya le dio tu número. la puse la conoce porque ella dejó su nombre y pues. No, eso no importa. Eso no importa, aunque usted no haya firmado ella y la dejó como aval de esta deuda. Entonces, al final nos contactamos con usted para que nos pague lo que se debe. De hecho, pues, básicamente le pagan los 100, 200, 300, 50, ahorita ya sin problemas, se termina el adeudo y puede seguir pidiendo dinero. Pero. Pues básicamente lo que tienen que conocer tiene que ser por el tipo y acordar. '}",¿Qué es.,,Frase cortada
15,15,1.04e+18,8E+11,3,2025/12/16 14:54,15,https://pcc-va.airudder.com/download/20251216/6b3d0aad91f94cc1bfa22ec0e73b0691/49b5dc596c324b2f82453bfcf48eedfc.wav,无还款诚意,120,"[['Por el momento no puedo contestar llamadas.', '1'], ['6 6 9 no. 0 no. ¡6!', '1'], ['Estoy trabajando.', '1'], ['Déjame tu mensaje.', '1'], ['Por favor grabe su mensaje.', '1'], ['Marque la tecla alto cuando termine.', '2'], ['Lo sentimos.', '2'], ['Ha alcanzado el límite de tiempo para dejar su mensaje.', '2'], ['Para únicamente dejar el mensaje, marque 1 para escucharlo, marque 2 para regrabarlo, marque 3 para continuar grabando, marque 4 para dejar su mensaje y desconectar, marque asterisco, asterisco para únicamente dejar el mensaje, marque 1 para escucharlo, marque 2 para regrabarlo.', '2'], ['Marque 3 para continuar grabando, marque 4 para dejar su mensaje y desconectar, marque asterisco, asterisco para únicamente dejar el mensaje, marque 1 para escucharlo, marque 2 para regrabarlo, marque 3 para continuar grabando, marque 4 para dejar su mensaje y desconectar. Marque asterisco. Asterisco.', '2']]",这录音就是 语音信箱,"通道1: Por el momento no puedo contestar llamadas estoy trabajando. Déjenme tu mensaje por favor. Gracias por su mensaje. Marche la teclagato cuando termine. En los sentimos. Al cansado límite de tiempo para dejar su mensaje para únicamente de dejar el mensaje. Marche 1 para escucharlo. Marche 3 para continuar grabando. Marche 4 para dejar su mensaje. En desconectar. Marche aterisco aterisco. Para únicamente de dejar el mensaje. Marche 1 para escucharlo. Marche 3 para continuar grabando. Marche 4 para dejar su mensaje. En desconectar. Marche aterisco aterisco. Para únicamente de dejar el mensaje. Marche 1 para escucharlo. Marche 2 para grabarlo. Marche 3 para continuar grabando. Marche 4 para dejar su mensaje. En desconectar. Marche aterisco aterisco.
通道2: 
","
Por el momento no puedo contestar llamadas, estoy trabajando. Déjenme tu mensaje, por favor.
Grabe su mensaje, márquela a Suslagartos cuando termine. Y lo sentimos. ¿Ha alcanzado el límite de tiempo para dejar su mensaje? Para únicamente dejar el mensaje, marque 1 para escucharlo, marque 2 para regrabarlo, marque 3 para continuar grabando, marque 4 para dejar su mensaje en desconectar, marque asterisco asterisco. Para únicamente dejar el mensaje, marque 1 para escucharlo, marque 2. Para regrabarlo, marque 3. Para continuar grabando, marque 4. Para dejar su mensaje y desconectar, marque asterisco asterisco. Para únicamente dejar el mensaje, marque 1. Para escucharlo, marque 2. Para regrabarlo, marque 3. Para continuar grabando, primer cuatro, para dejar tu mensaje en desconectar, marque asterisco asterisco.，正确都是个根本录音
¿Bueno? ","{'channel_0': 'por el momento no puedo contestar llamadas, estoy trabajando. déjame tu mensaje por favor. Grabe su mensaje, marque la tecla gato cuando termine. Lo sentimos, ha alcanzado un límite de tiempo para dejar su mensaje. Para únicamente dejar el mensaje, marque 1. Para escucharlo, marque 2. Para regrabarlo, marque 3. Para continuar grabando, marque 4. Para dejar su mensaje y desconectar, marque asterisco-asterisco. Para únicamente dejar el mensaje, marque 1. Para escucharlo, marque 2. Para regrabarlo, marque 3. Para continuar grabando, marque 4. Para dejar su mensaje y desconectar, marque asterisco asterisco. Para únicamente dejar el mensaje, marque 1. Para escucharlo, marque 2. Para regrabarlo, marque 3. Para continuar grabando, marque 4. Para dejar su mensaje y desconectar, marque asterisco asterisco. '},{'channel_1': 'no sabía por qué me iba a. No, no. '}",¿Cómo se llama el lugar que le ll.,,Incompleta
16,16,1.04e+18,8E+11,3,2025/12/16 11:05,15,https://pcc-va.airudder.com/download/20251216/64cd9db004514327bc98e413cd219aae/e8adec402bd447ff82911ffaab5b1fcb.wav,无还款诚意,120,"[['Hola, si dejas tu nombre y el motivo de tu llamada, revisaré si esta persona está disponible.', '1'], ['6 4.', '1'], ['Gracias.', '1'], ['Permanece en la línea.', '1'], ['Esta persona no está disponible si quieres dejar otro mensaje, responde después del tono.', '1']]",这录音就是 语音信箱,"通道1: Hola, si dejas tu nombre y el motivo de tu llamada, revisareci esta persona está disponible. Gracias. Permanece en la línea. Esta persona no está disponible. Si quieres dejar otro mensaje, respone después del tono. Si quieres dejar otro mensaje, respone después del tono. Si quieres dejar otro mensaje, respone después del tono. Si quieres dejar otro mensaje, respone después del tono.
通道2: 
","Hola, si dejas tu nombre y el motivo de tu llamada, revisaré si esta persona está disponible. Gracias, permanece en la línea. Esta persona no está disponible. Si quieres dejar otro mensaje, respondo después del tono.，正确都是个根本录音
¿Bueno? ","{'channel_0': 'hola, si dejas tu nombre y el motivo de tu llamada, revisaré si esta persona está disponible. Gracias, permanece en la línea. Esta persona no está disponible. Si quieres dejar otro mensaje, responde después del tono. '},{'channel_1': 'La única forma. '}",por la noticia como a las ocho,,Sin sentido
17,17,1.04e+18,8E+11,3,2025/12/16 18:50,15,https://pcc-va.airudder.com/download/20251217/566a05fc15f94f6b8427b93e854a8f0e/5aeb237e19ab4c33b1b6d8f3ea4b7094.wav,无还款诚意,119,"[['Está estoy llamando al número telefónico de Saúl grande.', '1'], ['¡6 6 no no 4 6!', '1'], ['Grabe su mensaje, marque la tecla gato cuando termine.', '2'], ['Lo sentimos, ha alcanzado límite de tiempo para dejar su mensaje, para únicamente dejar el mensaje.', '2'], ['Marque 1 para escucharlo, marque 2 para regrabarlo, marque 3, para continuar grabando, marque 4 para dejar su mensaje y desconectar, marque asterisco, asterisco para únicamente dejar el mensaje, marque 1 para escucharlo, marque 2 para regrabarlo, marque 3 para continuar grabando.', '2'], ['Marque 4 para dejar su mensaje y desconectar.', '2'], ['Marque asterisco asterisco para únicamente dejar el mensaje.', '2'], ['Marque 1 para escucharlo, marque 2 para regrabarlo, marque 3 para continuar grabando, marque 4 para dejar su mensaje y desconectar. Marque asterisco. Asterisco.', '2']]",这录音就是 语音信箱,"通道1: Estas te llamando al número de teléfónicos de Saú y Grande. Grate su mensaje. Marge la teclagato cuando termine. La teclagato cuando termine. La teclagato cuando termine. La teclagato cuando termine. Los sentimos. Al cansado límite de tiempo para dejar su mensaje. Para únicamente dejar el mensaje. Marquí uno. Para escucharlo. Marquitós. Para regrabarlo. Marquitrés. Para continuar grabando. Marquí cuatro. Para dejar su mensaje y desconectar. Marquí asterisco asterisco. Para únicamente dejar el mensaje. Marquitós. Para regrabarlo. Marquitós. Marquitrés. Para continuar grabando. Marquitós. Para dejar su mensaje y desconectar. Marquí asterisco asterisco. Para únicamente dejar el mensaje. Marquitós. Para regrabarlo. Marquitrés. Para continuar grabando. Marquitós. Para continuar grabando. Marquitós. Para dejar su mensaje y desconectar. Marquitós. Marquitós. Marquitós. Marquitós.
通道2: y y y y y y y y y y y y y y y y
","Está estoy llamando al número telefónico de Saúl Granda.
Grabe su mensaje, marque la tecla gato cuando termine. Lo sentimos. alcanzado el límite de tiempo para dejar su mensaje. Para únicamente dejar el mensaje, marque 1 para escucharlo, marque 2 para regrabarlo, marque 3 para continuar grabando, marque 4 para dejar su mensaje y desconectar, marque asterisco asterisco. Para únicamente dejar el mensaje, marque 1 para escucharlo, marque 2 Para regrabarlo, marque 3 para continuar grabando, marque cuatro para dejar su mensaje y desconectar, marque asterisco asterisco. Para únicamente dejar el mensaje, marque 1 para escucharlo, marque 2 para regrabarlo, marque 4 para continuar grabando, marque 4 para dejar su mensaje y desconectar, marque asterisco asterisco.正确都是个根本录音
¿Bueno? ","{'channel_0': 'Esto estoy llamando al número telefónico de Saúl Granda. Grabe su mensaje, marque la tecla gato cuando termine. Lo sentimos, ha alcanzado el límite de tiempo para dejar su mensaje. Para únicamente dejar el mensaje, marque 1. Para escucharlo, marque 2. Para regrabarlo, marque 3. Para continuar grabando, marque 4. Para dejar su mensaje y desconectar, marque asterisco-asterisco. Para únicamente dejar el mensaje, marque 1. Para escucharlo, marque 2. Para regrabarlo, marque 3. Para continuar grabando, marque 4. Para dejar su mensaje y desconectar, marque *#*#*Para únicamente dejar el mensaje, marque uno. Para escucharlo, marque dos. Para regrabarlo, marque tres. Para continuar grabando, marque cuatro. Para dejar su mensaje y desconectar, marque asterisco asterisco. '},{'channel_1': '¿Cómo? '}","con transparencia, ¿no?",,Fuera de contexto
18,18,1.04e+18,8E+11,3,2025/12/16 9:33,15,https://pcc-va.airudder.com/download/20251216/29b87ec92aa64431a2989b8f802970eb/d7009b547238432b96423fb9fd0708f0.wav,无还款诚意,119,"[['Hola, mi nombre es María Luisa y me llamo Luisa y me comunico con usted.', '1'], ['Grabe su mensaje, marque la tecla alto cuando termine.', '2'], ['Lo sentimos, ¡ha alcanzado el límite de tiempo para dejar su mensaje.', '2'], ['Para únicamente dejar el mensaje, marque 1 para escucharlo, marque 2 para regrabarlo, marque 3 para continuar grabando, marque 4 para dejar su mensaje y desconectar, marque asterisco asterisco para únicamente dejar el mensaje, marque 1 para escucharlo.', '2'], ['Marque 2 para regrabarlo, marque 3 para continuar grabando, marque 4 para dejar su mensaje y desconectar.', '2'], ['Marque asterisco, asterisco para únicamente dejar el mensaje, marque 1 para escucharlo, marque 2 para regrabarlo, marque 3 para continuar grabando, marque 4 para dejar su mensaje y desconectar. Marque asterisco. Asterisco.', '2']]",这录音就是 语音信箱,"通道1: Hola, me gustó un momento, me gustó un momento, me gustó un momento, me gustó un momento. Grate su mensaje. Marque la teclagato cuando termine. La teclagato cuando termine. Los sentimos. Al cansado límite de tiempo para dejar su mensaje. Para únicamente dejar el mensaje. Marque uno. Para escucharlo. Marque dos. Para regrabarlo. Marque tres. Para continuar grabando. Marque cuatro. Para dejar su mensaje y desconectar. Marque asterisco asterisco. Para únicamente dejar el mensaje. Marque uno. Para escucharlo. Marque dos. Para regrabarlo. Marque tres. Para continuar grabando. Marque cuatro. Para dejar su mensaje y desconectar. Marque asterisco asterisco. Para únicamente dejar el mensaje. Marque uno. Para escucharlo. Marque dos. Para regrabarlo. Marque tres. Para continuar grabando. Marque cuatro. Para dejar su mensaje y desconectar. desconectar. Marque hasta risco hasta risco.
通道2: 
","正确都是个根本录音
¿Bueno? Grabe su mensaje, marque la tecla gato cuando termine. Lo sentimos. ¿Ha alcanzado el límite de tiempo para dejar su mensaje? Para únicamente dejar el mensaje, marque uno. Para escucharlo, marque dos. Para regrabarlo, marque tres. Para continuar grabando, marque cuatro. Para dejar su mensaje y desconectar, marque asterisco asterisco. Para únicamente dejar el mensaje, marque 1. Para escucharlo, marque 2. Para regrabarlo, marque 3. Para continuar grabando, marque 4. Para dejar su mensaje y desconectar, marque asterisco asterisco. Para únicamente dejar el mensaje, marque 1. Para escucharlo, marque 2. Para regrabarlo, marque 3. Para continuar grabando, marque cuatro para dejar su mensaje y desconectar, marque asterisco, asterisco","{'channel_0': '¡Hola! ¿Está sonando el teléfono de su casa? Un. Graves un mensaje, marque la tecla gato cuando termine. Lo sentimos, ha alcanzado el límite de tiempo para dejar su mensaje. Para únicamente dejar el mensaje, marque uno. Para escucharlo, marque dos. Para regrabarlo, marque tres. Para continuar grabando, marque cuatro. Para dejar su mensaje y desconectar, marque asterisco asterisco. Para únicamente dejar el mensaje, marque uno. Para escucharlo, marque dos. Para regrabarlo, marque tres. Para continuar grabando, marque cuatro. Para dejar su mensaje y desconectar, marque asterisco asterisco. Para únicamente dejar el mensaje, marque uno. Para escucharlo, marque dos. Para regrabarlo, marque tres. Para continuar grabando, marque cuatro. Para dejar su mensaje y desconectar, marque asterisco asterisco. '},{'channel_1': nan}","farmacéutico Godena, etc. Herrera, ¿guarda? Cont. o las finales",,Mezcla incoherente de palabras
19,19,1.04e+18,8E+11,3,2025/12/16 17:24,15,https://pcc-va.airudder.com/download/20251216/310c40137c874cc0879026779c638792/9bec23db529d405ba85e676e5003a61c.wav,无还款诚意,118,"[['Estás te llamando al número telefónico de Saúl Granda.', '1'], ['¿Cuánto? ¿6 6? ¿Ah por 20 pesos? ¿6?', '1'], ['Grabe su mensaje, marque la tecla gato cuando termine.', '2'], ['Lo sentimos, ha alcanzado el límite de tiempo para dejar su mensaje para únicamente dejar el mensaje.', '2'], ['Marque 1 para escucharlo, marque 2 para regrabarlo, marque 3 para continuar grabando, marque 4 para dejar su mensaje y desconectar.', '2'], ['Marque asterisco asterisco para únicamente dejar el mensaje, marque 1 para escucharlo, marque 2 para regrabarlo, marque 3 para continuar grabando, marque 4 para dejar su mensaje y desconectar, marque asterisco, asterisco para únicamente dejar el mensaje.', '2'], ['Marque 1 para escucharlo, marque 2 para regrabarlo, marque 3 para continuar grabando, marque 4 para dejar su mensaje y desconectar. Marque asterisco. Asterisco.', '2']]",这录音就是 语音信箱,"通道1: Estás llamando al número telefónico de Saúl Grande. Grate tu mensaje. Marque la teclagato cuando termine. La teclagato cuando termine. La teclagato cuando termine. La teclagato cuando termine. Lo sentimos. Ha alcanzado límite de tiempo para dejar su mensaje. Para únicamente dejar el mensaje, Marque 1 para escucharlo. Marque 2 para regrabarlo. Marque 3 para continuar grabando. Marque 4 para dejar su mensaje desconectar. Marque asterisco asterisco. Para únicamente dejar el mensaje, Marque 1 para escucharlo. Marque 2 para regrabarlo. Marque 3 para continuar grabando. Marque 4 para dejar su mensaje desconectar. Marque asterisco asterisco. Para únicamente dejar el mensaje, Marque 1 para escucharlo. Marque 2 para regrabarlo. Marque 3 para continuar grabando. Marque 4 para dejar su mensaje desconectar. Marque asterisco asterisco.
通道2: MetEs MITку P lo demás en estewechselo estamos haciendo este los Que consiguen este y por favor, y, ¿qué le eché a la mano? ¿Qué le eché a la mano? ¿Ajá? ¿Ajá bien? ¿Ajá bien? ¿Ajá bien? ¿Ají no foremta? ¿Ají no foremta? ¿Ají no foremta? ¿Ají no foremta? ¿Ají no foremta? ¿Ají no foremta? ¿DIET ходó fina? ¿ evacuateó fina? ¿que ponieron? Le Literally, la ventana en el park… ¡Bueno! V signó que levaba al lado, provingía que cuando regresaban a buscar, después había venido con ese typo. te te fundas.
","; Está estoy llamando al número telefónico de Saúl Granda.
Grabe su mensaje, marque la tecla gato cuando termine. Nos sentimos. ha alcanzado el límite de tiempo para dejar su mensaje para únicamente dejar el mensaje marque 1 para escucharlo marque 3 para regrabarlo marque 3 para continuar grabando marque 4 para dejar su mensaje y desconectar marque asterisco asterisco Para únicamente dejar el mensaje, marque 1 para escucharlo, marque 2 para regrabarlo, marque 3 para continuar grabando, marque 4 para dejar su mensaje y desconectar, marque asterisco asterisco. Para únicamente dejar el mensaje, marque 1 para escucharlo, marque 2 para regrabarlo Marque tres para continuar grabando, marque cuatro para dejar su mensaje en desconectar, marque asterisco asterisco","{'channel_0': 'Estoy llamando al número telefónico de Saúl Grande. Grabe su mensaje, marque la tecla gato cuando termine. Lo sentimos, ha alcanzado el límite de tiempo para dejar su mensaje. Para únicamente dejar el mensaje, marque 1. Para escucharlo, marque 2. Para regrabarlo, marque 3. Para continuar grabando, marque 4. Para dejar su mensaje y desconectar, marque * * . Para únicamente dejar el mensaje, marque 1. Para escucharlo, marque 2. Para regrabarlo, marque 3. Para continuar grabando, marque 4. Para dejar su mensaje y desconectar, marque *asterisco* asterisco. Para únicamente dejar el mensaje markque uno para escucharlo mark二 para re grabarlo markque tres para continuar grabando cuatro para dejar su mensaje yonear markcoco. '},{'channel_1': 'Ciento cincuenta y. ¿qué familiares están en el motor? ¿Cuál es el? ¿Y la busca? setenta ciento cuarenta. ¿Cuál. por veinte pesos. '}",tomarme la molestia de llamarme por la ocupación que tiene,,Mal redactado
