,Unnamed: 0,催收外呼id,客户号,渠道,外呼时间,联系结果,通话录音,collection_result,call_seconds,火山asr,错误点,科大翻译,错误点,阿里云asr,错误点,,"Mal redactado, incoherente"
30,30,1.04e+18,8E+11,3,2025/12/16 9:24,15,https://pcc-va.airudder.com/download/20251216/f727d9a919b54b24b1482fdbb30a1d91/93f27e5f355c4f508f80d2b421440c0c.wav,无还款诚意,112,"[['Hola, Hola, ¡Hola!', '1'], ['Bueno, Buenos días, ¿cómo suzco?', '1'], ['Javier es este 1 préstamo que tiene con nosotros y está en moratorio.', '1'], ['No, disculpe, es Jorge.', '2'], ['Tengo registrado como señor 9, ¿escucho.', '1'], ['Ajá, ¿me quieres quitar algo?', '2'], ['¿Como qué?', '2'], ['Hola, Hola, ¿qué Tal?', '2'], ['Sí, sí, lo que pasa que este de sí, lo que pasa que este de, pues yo no tengo contacto con él.', '1'], ['¿Okay?', '1'], ['Escucha, pues sí, ¿pero pues yo qué puedo hacer?', '2'], ['Yo vivo en otro lado, él vive en playa, digo, él vive en Cancún, yo estoy en cosumel.', '2'], ['Yo no tengo contacto con él, o sea, sí, ajá, pero lo que pasa es que yo no tengo, o sea, yo no tengo su número.', '2'], ['Transmitirle el mensaje de que debe no mire, no se preocupe, momento yo información del cliente para poderlo, ¡ya que dejó usted como 5!', '1'], ['Yo lo veo nada más.', '2'], ['Con ándale 6, ¿no te parece que estás fallando tu número?', '1']]",por favor hazle saber acerca de mi mensaje ,"通道1: No. No. No. No. Si. Si. No. No. No. No. No. No. No. No. No. No. No. No. No. No. No. No. No. No. No. No. No. No. No. No. No. No.
通道2: Bueno, buenos días. ¿Cómo sus? Escujaviles de. ¿Cómo se? Fue un préstamo que tiene con nosotros y está en moratorio. Tengo registrado con el señor. Ya vieres. Escúchense. A mí me he colocado el señal antes de que había quedado. Dejen no hacerlo a su número. Escúchense. A mí me he colocado el señal antes de que había quedado. Dejen. No lo es. Bueno, no es como referencia principal. ¿Tirle el mensaje de que debe de favor? Sí, no. No me den a se preocupa. No me den a se preocupa. Yo es la información del cliente para los que se ha quedado. Yo no me he colocado el señal antes de que había quedado. No me den a se preocupa. Yo es la información del cliente para los que se ha quedado. ¿Cómo? No me he colocado. No me he colocado.
","
Bueno, buenos días, Javier es de.
No, disculpe es Jorge.
Un préstamo que tiene con nosotros y está en moratorio, tengo registrado con el señor.
¿Ajá, me quiere registrar algo como qué? Bueno, escucha, sí, lo escucho, sí, mire.
Estoy localizando al señor Francisco, ajá.
Sí, lo que pasa es que es de, pues yo no tengo contacto con él.
Okay, mano y como referencia principal.
Pues sí, pero pues yo que puedo hacer yo en vivo en otro lado, él vive, él vive en Cancún, yo estoy en Cozumel, yo no tengo contacto con él.
Decirle el mensaje de que debe de, por favor.
Sí, ajá, pero lo que pasa es que yo no tengo, o sea, yo no tengo su número, no lo veo nada más con, vale.
No, mire, no se preocupe, un momento yo le doy la información del cliente para poderlo, ya que dejó usted como.
Lo que pasa es que estás fallando tu número根据录音正确都是对","{'channel_0': 'hola. sí, sí, hola. no, disculpe es Jorge. ajá, me quieren recitar algo como¿qué. hola. Eso es lo que queremos. ajá. sí, lo que pasa es que este, sí, lo que pasa es que este de pues yo no tengo contacto con él. bueno. pues sí, pero pues yo que puedo hacer, yo vivo en otro lado, él vive en Cancún, estoy en Consumel. yo no debo contactar con él, o sea. sí, ajá, pero lo que pasa es que yo no tengo, o sea, yo no tengo su número, yo lo veo nada más. vale. ¿Y no? se parece que estás vallando tu número. '},{'channel_1': 'Bueno, ¿buenos días? ¿Cómo se llama usted? ¿Cómo. Un préstamo que tiene con nosotros y está en moratorio. Tengo registrado como señor. Sí, claro. Escuche. No. no usarlo a su número personal. ok, manuel como referencia principal. enviarle el mensaje de que debe de. sí, no mire, no se preocupe, en este momento yo le doy la información del cliente para que pueda verlo ya que hoy usted como. ¿qué? '}",las damas. Buenos días,,Mal transcrito
31,31,1.04e+18,8E+11,3,2025/12/16 18:06,14,https://pcc-va.airudder.com/download/manual/d3a8461998d511804b9830009ed5d7ac.wav,答应转告,109,"[['Bueno, está mal.', '1'], ['Bueno, celda, hablamos de parte de tu amigo Armando Ruiz Juárez, hablamos de olapina, tiene 1 saldo pendiente de 2 314 pesos que tiene que pagar lo más pronto posible.', '1'], ['Bueno, Lalo, quién habla al no le entiendo.', '1'], ['¡Hablamos de Hola Fina!', '1'], ['Respecto al pago a Manuel Juárez, que dejó este número válido como referencia, es importante que realicen el pago de 2 014 pesos pronto posible.', '1'], ['A ver de quién me está hablando.', '1'], ['Hablamos de Hola Fina.', '1'], ['Respecto a tu amigo Armando Ruiz Juárez, él dejó este número como vale como referencia.', '1'], ['Ajá, lo a Jairo.', '1'], ['Tienen que pasar a pagar el saldo pendiente estos 714 pesos a la brevedad, eso arréglalo con el señor Armando.', '1'], ['Aval, referencia Tal vez sí, pero aval no.', '1'], ['Ah, bueno, pero me dice aval.', '1'], ['Yo no soy su aval, su referencia Tal vez, pero aval no.', '1'], ['Él dejó su número como vale como referencia.', '1'], ['Ah, pero yo no le firmé para que fuera válido.', '1'], ['Referencia Tal vez sí, pero era válido.', '1'], ['Eso arréglalo con el señor armando, de lo contrario se te van a seguir realizando las llamadas. ¡9!', '1'], ['Ah, yo le digo, yo le digo, por favor, ¡ya no me estén molestando yo ahorita yo me encargo de decirle, ¡pero por favor ya no me estén molestando!', '1']]",1./ celia 2./ a pero como aval no  3./ pero yo no le firme para que fuera aval,"通道1: Bueno, tan bueno. Lalo. ¿Quién habla? No le entiendo a ver de quién me está hablando. ¿Quién habla? No le entiendo a ver de quién me está hablando. ¿Has lo? ¿Has lo? ¿Has lo? ¿Has lo? ¿Referencia tal vez sí, pero aval no? Bueno, pero me dice aval yo no soy su aval, su referencia tal vez tu aval no. Aprejando a le firme para que fuera aval. Referencia tal vez sí, tu aval no. Ay, yo le digo. Ya le digo, por favor, yo no me estén molestando. Y ahorita yo me cargo de decirle, pero por favor, yo no me estén molestando.
通道2: Bueno, childa, hablamos de parte de su amigo Armando Luis Juarez. Hablamos de Olafina. Quienes son opiniones los 1314 pesos que tiene que pagar. Lo más pronto posible. Hablamos de Olafina. Hablamos de Olafina. Respecto a tu amigo Armando Luis Juarez. Hablamos de Olafina. Hablamos de Olafina. Hablamos de Olafina. Respecto a tu amigo Armando Luis Juarez. Hablamos de Olafina. Hablamos de Olafina. Hablamos de Olafina. Hablamos de Olafina. Hablamos de Olafina. Hablamos de Olafina. Hablamos de Olafina. Hablamos de Olafina. Hablamos de Olafina. Hablamos de Olafina. como referencia, incluso, de la ciudad de Corracción. Esto va a regalarlo con el señor Armando de los contrarios, se te van a seguir realizándome llamadas. Los llamadas están de manera autónoma.
","Bueno, Kelda, hablamos de parte de tu amigo Armando Ruiz Juárez, hablamos de Olapina, tiene un saldo pendiente de 2314 pesos que tiene que pagar lo más pronto posible.
¿Quién habla?
Hablamos de Olapina. El perfecto de pago al margares que le cuesta el número igual y como refugia es importante que realicen el pago de 2014 pesos más pronto posible.
No le entiendo, a ver, ¿de quién me está hablando?
Hablamos de hola fina. Respecto a tu amigo Armando Ruiz Juárez.
Ajá, ¿y lo.
Mira el dejo este número como aval y como referencia, tienen que pasar a pagar.
Aval, referencia, tal vez sí, pero aval no.
Son 700, 14 pesos a la brevedad.
Ah, bueno, pero me dice aval, yo no soy su aval, su referencia tal vez pero aval no.
Eso, arreglelo con el señor Armando, él dejó su número como aval y como referencia, incluso dijo...
Ah, pero yo no le firmé para que fuera aval.
Referencia tal vez con el señor Armando, de lo contrario se te van a seguir realizando las llamadas.
Ah, yo le digo. Yo le digo, por favor, ya no me estén molestando, yo ahorita yo me encargo de decirle, por favor, ya no me estén molestando.根据录音正确都是对","{'channel_0': 'bueno, está mal, bueno. Lalo. ¿quién habla? no le entiendo, a ver de quién me está hablando. ajá, no. ajá y lo. Aval, referencia tal vez sí pero aval no. ah bueno, pero me dice aval yo no soy su aval, su referencia tal vez, pero aval no. ah, pero yo no le firmé para que fuera válida referencia tal vez sí, pero válida no. Ah, yo le digo. ya le digo por favor ya no me estén molestando, yo ahorita yo me encargo de decirle, pero por favor ya no me estén molestando. '},{'channel_1': 'bueno chelda hablamos de parte de tu amigo armando ruiz juárez, hablamos de olafina tiene un saldo pendiente de dos mil trescientos catorce pesos que tiene que pagar. lo más pronto posible. hablamos de hola fina. que después está en un valor aproximado es importante que realicen el pago de dos mil catorce pesos. pronto posible. hablamos de hola fina respecto a tu amigo armando ruiz juárez. él dejó este número como aval y como referencia, tienen que pasar a pagar el saldo pendiente de 714 pesos a la brevedad. eso arreglélo con el señor Armando, él dejó su número como vale y como referencia. Incluso, dijo, esto arreglélo con el señor Armando, de lo contrario se te van a seguir realizando las llamadas. de manera automática. '}",solamente para que le dijes a tu hombre que te acostaste con él,,Frase incoherente y fuera de lugar
32,32,1.04e+18,8E+11,3,2025/12/16 15:05,17,https://pcc-va.airudder.com/download/20251216/c402cfdf8ab24347b7b04aa53d38412c/03d06e6c90ea435fb684b22f9116fdf2.wav,无法沟通,107,"[['¿6 nada de quién dice de dónde me habla Michael?', '1'], ['Sí, Hola, ¿qué Tal?', '1'], ['Buenas tardes, 1 gusto con Eduardo Zambrano.', '1'], ['Sí, Hola, qué Tal, me estoy comunicando de la financiera la pila, necesito que su pago pendiente con la cantidad de 405 pesos para el día de hoy sí, el cual es muy importante que lo realice hasta el día de hoy sí. ¿Cuánto tiempo tardo para este día? ¿Hola Fina? ¡Sí!', '1'], ['¿De la financiera de igual?', '1'], ['Ya le envié lo que es 1 mensaje donde aparece su línea de pago para que lo pueda hacer por transferencia y 1 código para que pueda ser acudido a alguna tienda.', '1'], ['Pero no, no, no escucho bien.', '1'], ['¿Me puedes mandar 1 mensaje?', '1'], ['¿De qué?', '1'], ['De qué línea es, ¿por favor?', '1'], ['Eso no escucho bien.', '1'], ['Y bueno como le acabo de decir realiza su pago antes de la vamos a cerrar antes de las 5 de la tarde, ¿correcto?', '1'], ['¿Sí?', '1'], ['Por favor, Gracias.', '1'], ['Muy bien, ¡estaré en espera de su pago, señor.', '1'], ['Muy bien.', '1'], ['Bueno, entonces nos vemos el siguiente día, ¿sí?', '1'], ['¿Me manda de qué?', '1'], ['¿De de dónde me está marcando?', '1'], ['De la financiera o la Fina sí o la Fina su préstamo sí, ¿me estoy comunicando de respecto a su pago pendiente de su préstamo en la Fina sí o no 145 pesos?', '1'], ['¿De la financiera?', '1'], ['¿Qué dice?', '1'], ['No lo escucho bien, señor.', '1'], ['¿Me puede mandar en 1 mensaje? Me escucho bien, sí.', '1'], ['Dele bien en escucharme nuevamente.', '1'], ['Sí, sí, ¿estaré en espera de que en el momento que usted realice su pago son 405 pesos. Muy bien. Bueno, ¡que tenga Buena tarde!', '1']]","cuanto tiempo para que quede su pago 2,/  lo esperamos en cuanto cierren las tiendas donde usted puede ralizar al pago ","通道1: de la Fima del Ciera de Igual. Pero no, no, no, no es cuyo bien, no es cuyo bien, no es cuyo bien, no es cuyo bien. Si por favor, la lluvia. No me anda a ver qué es de donde me mataba el cambio. De la Fima del Ciera, ¿qué dice? No les puchó bien, señor. No les puchó bien, señor. Me pueden mandar en un entadre. Les puchó bien. Vale.
通道2: Fox 9. Si hay hasta altcos mas leste. Algo handler. Y que tienen vale Park Vamos con otro de las�. de financiera o la fina, ¿qué es el caro sufre esta? O la fina, si ya les vienos que es un mensaje donde apareces fina de cabo para que lo podases por transcurencia, un favorito para que se se puede ser aquí, ¿as no tiene? Amor bien perfecto, si nuevamente mide eso, lo voy bien bien en este momento, parece lo que es una diga, y bueno, como la acabo de decir, a veces paja desde la, ¿cuáles es el gran barato de la chico de la parte por esto? Bueno bien, tenemos que ver a los escupagos, ¿no? Bloody para? Aun aanı a 아니� rising ¿No, asi te la finas, ¿o la fina si no? Sí,oder, si, swimming o puesto de! signes
","Sí, hola, ¿qué tal? Buenas tardes, un gusto con el gato de Martín. Hola, ¿qué tal? Me estoy comunicando de la financiera de la vida. ¿Qué es un pago permite con la cantidad de 405 pesos para el día de hoy? Sí, el pago es muy importante que lo realicemos para el tipo de más corto de recambio. Sí, estamos con su pago para este día.
¿De quién dice? ¿De dónde me ha?
Dado Marta.
De la financiera ¿De cuál?
Sí, ya le envié lo que es un mensaje donde aparece su línea de pago para que lo pueda hacer por transferencia y un código para que pueda ser acudir a alguna tienda.
Pero no, no, no escucho bien, me puede mandar un mensaje de que este línea...
Muy bien, perfecto, sí, nuevamente mire, se lo voy a enviar en este momento Por.
Favor, yo no escucho bien.
Y bueno, como le acabo de decir, realizar su pago antes de la o vamos a estar antes de las 5:00 de la tarde, ¿correcto.
Sí, por favor.
Estaremos a esperar de su pago, señor. Muy bien, bueno.
Anda, ¿de dónde me está marcando?
Sí, ¿de la financiera o la financiera.
La financiera, ¿qué dice?
O la financiera, es un préstamo. No le escucho bien, señor, ¿me puede mandar en mi mensaje?根据录音正确都是对","{'channel_0': '¿Y ande? ¿de quién dice de dónde me arrojó Michael? entre la simonciera y el cual. pero no, no, no escucho bien, me puedes mandar un mensaje de que, de que línea. por favor, yo no escucho bien. sí, por favor, gracias. me manda de que, de, de dónde me mata marcando. de la finalización, ¿qué dicen? no le escucho bien, señor. me puede mandar un mensaje. me escucho bien. bueno. '},{'channel_1': '¿Cómo se llama el barrio de la ciudad de San José? me estoy comunicando de la financiera afila, quiero que te sume a mi cuenta con la cantidad de cuatrocientos cincuenta pesos para el día de hoy, sí, el cual es muy importante, pero. sí estamos con su pago para la feria. de financiar o las finanzas, ¿quién está acercando esos préstamos? hola fina sí ya les envío que es un mensaje donde aparece su línea de pago para que lo puede hacer por transferencia y un código para que pueda hacer acudir a alguna tienda. muy bien, perfecto, sí, nuevamente me lo voy a enviar en este momento, parece lo que es una ligada y bueno, como le acabo de decir, a realizar su pago antes de la vamos a estar antes de las cinco de la tarde, correcto. También. de la financiera o la finanza. o la final. sí me fue comunicando de respecto a su padre el viernes sufrió una. sí, estaré en espera de que el momento que se realice el sorteo, ya cuatrocientos cinco pesos. '}",Algunos polientes de perros,,Sin sentido
33,33,1.04e+18,8E+11,3,2025/12/16 10:26,17,https://pcc-va.airudder.com/download/20251216/c10bb08b59d748fc9b237ce6d0099582/f609e0b8a1e74fd78054e3fa3d4195ff.wav,无法沟通,106,"[['1 3 9 ah, eh, ahí me escuchas bien.', '1'], ['Buenos días, ¡Hola!', '1'], ['Eh, tampoco lo escucho bien, señor, tener a la oyeya lo escuchó bien.', '1'], ['Bueno, ah, bueno, Mira, te comento, yo no soy Alan.', '1'], ['Esta línea no es de él, ya tiene muchísimos años con los de él desconozco porque él sigue utilizando mi línea.', '1'], ['Yo tengo más de 10 años con este número. Sí, ¿okay? Okey, sí, está muy bien, perfecto. ¡Gracias!', '1'], ['Qué perfecto.', '1'], ['Mire, ¿tiene WhatsApp usted?', '1'], ['Ah, okay, eh, me voy a me comunicarme por 2º de ese, por 2º de WhatsApp para nada, nada del teclado.', '1'], ['Es que usted puso como referido, entonces este que no nos sigan molestando, podría de 1 este titular y así para que pues la elimine, entonces Ella debe ser la responsable y y es la titular, entonces necesito que, pues, haga el reclamo para que no le estén molestando. Señora 7.', '1']]","1.- senor me comunico de holfina  , 2.- esta linea ya tiene muchisimos años  que no es de el ","通道1: Bueno. Ahí me escuchas, mi. Bueno. Ah, bueno, me voy a te comento. Yo no soy, alas, esta línea no es de él. Tengo más de 10 años con este número. Ok. Ok, sí estamos en perfecto.
通道2: Bueno, ¿díes, Ana? ¿Dónde? Ah, ahí. ¿Dónde? ¿Dónde? ¿Dónde? Bueno, bueno, ¿eh? ¿Dónde? Eh, tampoco les escuché bien, señor. ¿Dónde? ¿Dónde? ¿Dónde? ¿Dónde? ¿Dónde? ¿Dónde? ¿Dónde? ¿Dónde, señor? ¿Dónde? ¿Dónde? ¿Dónde? ¿Dónde? ¿Dónde? ¿Dónde? ¿ alignedología? ¿Dónde? ¿Dónde? Entonces, no se ve el molestano podría de un... No, no se ve la licencia de decirla responsable y es la que tú la ve, entonces, en el sitio que suagal reclamó para que no le se ve el molestano, señora. Hola. Hola, señora.
","Bueno, buenos días, Ana.
Bueno, permíteme, es una amable.
Tampoco lo escucho bien, señor, bueno, bueno, ahí lo escucho bien.
Ah, bueno, mira, te comento, yo no soy Ana, esta línea no es de él, ya tiene muchísimos años que nos dé, él desconozco porque él sigue utilizando mi línea, yo tengo más de 10 años con este número.
Perfecto, mire, ¿tiene WhatsApp usted? Sí, ok, me voy, me comunícame por medio de ese, por medio de WhatsApp para. Es que le puse como referido, entonces este para que no nos sigan molestando podría darle un titular para que pues la elimine, entonces ella debe ser la responsable y es la titular, entonces necesito que haga el reclamo para que no le estén molestando, señora.
Ok, sí, está muy bien, perfecto.
Gracias. Saludos, señora根据录音正确都是对Bue","{'channel_0': 'bueno. bueno. No lo permiten, pero no lo haré. bueno bueno. Ah, eh, ¿ahí me escuchas bien? bueno. Ah, bueno, mírate, comentó yo no sé hoy Alan. Esta línea no es de él, tiene muchísimos años que no es de él, desconozco porque él sigue utilizando mi línea. Yo tengo más de diez años con este número. Okay. ok, sí está muy bien, perfecto. gracias. '},{'channel_1': 'buenos días, alana. ¿qué? tampoco lo escucho bien, señores. ¿Y tú. usted debe mirar a la radio, la. ah, oye, ¿me lo escuchó bien? ¿perfecto? Mira, ¿tiene WhatsApp usted? ah ok, me voy, me comunico por medio de ese, por medio de WhatsApp para. no, no del, de que, es decir, de que como referido entonces este, el que no nos vaya molestando podría un. no, tú lo haces para que pues la elimines, así que ya te ves la responsable y es la titular, entonces necesito que pues haga el reclamo para que no le estén molestando señora. 응? Saludos señ. '}",esco,,Error repetido
34,34,1.04e+18,8E+11,3,2025/12/16 12:32,20,https://pcc-va.airudder.com/download/20251216/f9748e46c57143c2ac1a0e29928d23c7/be14e7bd65a441b5830193df467b9951.wav,称不认识,105,[],录音上没有这个录音,"通道1: No. No. No. No. No. No. No. No. No. Está aquí bucado. Está aquí bucado. Un quien de zeblas. Usó para quien de edad de pincha en morcitos porque yo no tengo ninguno morcito. Está aquí bucado y se siguen chingando y siguen chingando el rueda en un infierno. Pero cual pareja yo soy vivo solo. No sé pero está aquí bucado. Ahora lo que quisiera saber, ¿por qué están moestando? Están diciendo que esa persona no lo conozco. No sé porque hay un, donde es como un nombre, una compición. No lo manda por, no lo manda por lo que está aquí.
通道2: Hola, buenos días. ¿Me comunico con la pareja de Aparía? ¿Me comunico con la pareja de Maria? ¿Cómo este equivocado si lo tiene como amorcito? María la tiene como referencia en un pésamo que no ha pagado desde hace siete días. Hasta que me favor y diga de a su amorcito que pague. Pues así la tira registrado y lo dejo como referencia en el pésamo. ¿De qué nos da renunciar? Porque su pareja de bella. Quiero tener como referencia. Entonces ahí usted se cheque a quien le da su número. Con gusto le puedo dar el número de esa persona para que se comunique con ella y se ve por qué no anda dejando como referencia. ¿Cómo? Quiero decir un salemando el número para que se comunique con ella. Perfecto. ¿Tiene dónde apuntar para que le diga por qué no anda dejando como referencia a ustedes cuando la quiere verse y la le parece?
","根据录音正确都是对Bueno, buenas tardes, bueno, buenas tardes, tengo el gusto con Rodríguez Acevedo, Rubén. Buenas, ¿me escucha? Tengo el gusto con Rodríguez Acevedo, Rubén.
Ya llegamos.
Mucho gusto señora Blasfacesor financiero de Olatina, el motivo de la llamada es para recordarle que tiene un pago pendiente de 240 pesos con respecto al préstamo que solicito, le recomiendo señor que lo pague hoy para que no aumente su deuda por atraso, lo puede realizar en transferencia bancaria o en efectivo en algún establecimiento como CEO en el EBE, Farmacia Guadalajara, Aurrera o Warma. Contamos con tu pago el día de hoy señor Rodriguez.
Me marcaba la fecha hasta el 17 de este mes, están mañana.
Ah, si es señor, pero algunos establecimientos no abren o luego tienen dificultades y pues si no lo registra la diferencia también dice.
Y la haría por transferencia.
Ah, muy bien señor, ¿contamos con su pago el día de hoy.
Eh, si, más tarde lo realizaría.
Como en 1 hora o un poco más.
Yo creo que un poquito más.
Muy bien, señor, le agradezco por su compromiso, que páseme el comité.","{'channel_0': 'no. hola. ¿Mamá? No, está equivocado. estoy equivocado con quién te se hablar. Yo sé a quién se le hace pinche amorcito, porque yo no tengo ningún amorcito. Pues no sé, está equivocado. Y si siguen chingando, y si siguen chingando, les voy a denunciar. pero cual pareja yo soy vivo solo. no sé pero está equivocado. ¿Qué quisiera saber? Es lo que quisiera saber, ¿por qué están molestando? Si están diciendo que esa persona le digo que no la conozco. Pues sí, porque ahí hay un, un este, ¿cómo se llama? Una confusión. a a a me lo manda por a me lo manda por whatsapp. '},{'channel_1': 'hola, buenos días. Me comunico con la pareja de la maría. me comunico con la pareja de maría. ¿Cómo está equivocado si lo tiene como amorcito? María lo tiene como referencia en un préstamo que no ha pagado desde hace siete días. Hágale favor y dígale a su amorcito que pague. pues así lo tiene registrado y lo dejo como referencia en el préstamo. de que nos va a denunciar, de que su pareja debe. si usted lo tiene como referencia, entonces ahí usted checa a quién le da su número. con gusto le puedo dar el número de esa persona para que se comunique con ella y saber por qué lo anda dejando como referencia. cómo. por eso sí, no está le mandó el número para que se comunique con ella. perfecto, tiene donde apuntar para que le diga que por qué lo anda dejando como referencia a usted cuando la que debe ser ya le parece. bueno. '}",no soy su papá,,Fuera de contexto
