,Unnamed: 0,催收外呼id,客户号,渠道,外呼时间,联系结果,通话录音,collection_result,call_seconds,火山asr,错误点,科大翻译,错误点,阿里云asr,错误点,,"Mal redactado, incoherente"
53,53,1.04e+18,8E+11,0,2025/12/16 17:38,12,https://nxai-hk-1259196162.cos.ap-hongkong.myqcloud.com/20251217/25523/cf2d8a29-7e79-42b0-a0cf-a75631c5a986.mp3,承诺付款,90,"[['¿4 9?', '1'], ['Bueno, buenas tardes, tengo el gusto con el señor de la Rosa Méndez Emmanuel.', '1'], ['Mucho gusto señor, habla su asesor financiero de holavina, el motivo de la llamada es para recordarle que tiene 1 pago vencido de 240 pesos.', '1'], ['¿No?', '2'], ['Se requiere señor que lo pague hoy para que no le genere 1 gasto extra o aumente la deuda por atraso.', '1'], ['Lo puede realizar mediante transferencia bancaria o en algún establecimiento como Walmart, Seven Eleven, Aurrerá o también en farmacias de Guadalajara, contamos con ese pago el día de hoy, señor Méndez, muy bien, ¿como en cuánto tiempo lo está realizando?', '1'], ['Sí.', '1'], ['¿En 1 hora o 1 hora y 2ª más o menos? Sí, ¿0? No, sí. ¿Quién es la otra?', '1'], ['Ah, muy bien señor.', '1'], ['De todas maneras le enviamos 1 mensaje de texto a su teléfono celular mediante SMS, ¿ahí menciona el link para que pueda eh dirigirse eh?', '1'], ['En su navegador le aparece su nombre y el monto de que VA a pagar que es 240.', '1'], ['¿Le aparece la opción como le mencioné ¿eh ¿eh?', '1'], ['Por clave interbancaria o también eh pago en efectivo en los establecimientos que aparecen ahí cuando le genere el código de barra.', '1'], ['Le agradezco su compromiso, señor Méndez, ¡que pase 1 buen día!', '1']]",根据录音都是正确,"通道1: A mí no. Y ahora qué? Bien. qué tunas colg additional relógico la y y y y y y y y y y y
通道2: Bueno, con la tarde, tengo el gusto con el señor de la rosa mente de ese Manuel. Mucho gusto, señor. Apla su asesor gineanciero de olacina. Es mosa tipo de la llamada para recordar que tiene un pago vencido de unos sitos con el capeso. Si requiere el señor que lo pague hoy, ¿para qué no les deniera un gasto extra o aumenta la de otra por atrás? Lo puede realizarme mediante la rosa de señor Cariac. Voy a dar con esto el exigimiento como gual más, yo me dile bien, vamos a ver verás. O también en farmacias o de la cara. Contamos con ese pago el día de hoy, señor Mendez. Muy bien, como en cuanto tiempo la te realizando. Ah, muy bien, señor. De todas maneras le enviamos un mensaje de sexos teléfono celular mediante el MH. Ahí menciona, el link para que pueda dirigirse en su navegador. La pared es un nombre y es un modo de desbapagar que esto sientos por detrás. La pared es un opción como le mencioné por Clavita bancaria o también en pago el efectivo en los establecimientos que aparecen ahí cuando le genere el código de barra. Le agradezco por propiosos, señor Mendez. Y pasen un poquito.
","根据录音正确都是对Bueno.
Bueno, buenas tardes, tengo el gusto con el señor de la Rosa Méndez de Manuel. Mucho gusto señor, habla su asesor financiero de Olafina. El motivo de la llamada es para recordarle que tiene un pago vencido de 240 pesos. Requiere señor que lo pague hoy para que no le genere un gasto extra o aumente la deuda por atrás. Lo puede realizar mediante transferencia bancaria, o en algún establecimiento como Walmart, Sevendeleve, Oferera o también en Farmacias Guadalajara. ¿Contamos con ese pago el día de hoy, señor Méndez.
Sí.
Muy bien, ¿Cómo en cuánto tiempo lo está realizando?
En 1 hora, con 1 hora y media más o menos.
Ah, muy bien señor. De todas maneras le enviamos un mensaje de texto a su teléfono celular mediante SMS ahí menciona un link para que pueda dirigirse en su navegador le aparece su nombre y el monto que va a pagar que es 240 le aparece la opción como le mencioné por clave interbancaria o también pago en efectivo en los establecimientos que aparecen ahí cuando le genere el código de barras Le agradezco a su compromiso, señor Méndez, que pase un momentito.根据录音正确都是对","{'channel_0': 'Pero. sí. ¿Y no nada con una lengua más o menos? Mmm. Sí, sí, sí. '},{'channel_1': 'Buenos días, tengo el gusto con el señor de la Rosa Mente Manuel. Muchas gracias, señor. Habla su asesor financiero de Olafina. El motivo de la llamada es para recordarle que tiene un pago vencido de 240 pesos. Si requiere, señor, que lo pague hoy, para que no le genere un gasto extra o aumente la deuda por atrasos, lo puede realizar mediante una solución bancaria o en algún establecimiento como Walma, Seven Eleven, etc. O también en farmacia Guadalajara. Contamos con ese pago el día de hoy, señor Méndez. muy bien, como en cuánto tiempo la está realizando. Ah, muy bien, señor. De todas maneras, le enviamos un mensaje de texto a su teléfono celular mediante SMS. Allí menciona el link para que pueda dar. Dirigirse en su navegador, le aparece su nombre y el monto que va a pagar, que es 240. Le aparece la opción como le mencioné por clavímetro bancaria o también pago en efectivo en los establecimientos que aparecen ahí cuando le genere el código de barras. Gracias, compadre, señor Méndez, gracias. '}",s1.- seven eleven transferencia bancaria ,,
54,54,1.04e+18,8E+11,3,2025/12/16 16:22,17,https://pcc-va.airudder.com/download/manual/7a479e7e9767d64e006fc2bc357d5a75.wav,无法沟通,90,"[['Por favor, grabe su mensaje después del tono.', '1'], ['0 por el momento se la puede manejar.', '1'], ['¿Por el momento se la puede manejar ¿la garza blanca 4 qué? ¿Cuánto tiempo también?', '1']]",这是语音信箱 ,"通道1: Por favor, grave sumanzaje después del tono. En el momento de la vida, la vida de la vida, la vida de la vida, la vida de la vida, la vida de la vida, la vida de la vida, la vida de la vida, la vida de la vida de la vida. En el momento de la vida de la vida de la vida de la vida de la vida de la vida de la vida de la vida de la vida de la vida de la vida de la vida de la vida de la vida de la vida de la vida de la vida de la vida de la vida de la vida de la vida de la vida de la vida de la vida de la vida de la vida de la vida de la vida de la vida de la vida de la vida de la vida de la vida de la vida de la vida de la vida de la vida de la vida de la vida de la vida de la vida de la vida de la vida de la vida de la vida de la vida de la vida de la vida de la vida de la vida de la vida de la vida de la vida de la vida de la vida de la vida de la vida de la vida de la vida de la vida de la vida de la vida de la vida de la vida de la vida de la vida de la vida de la vida de la vida de la vida de la vida de la vida de la vida de
通道2: dando todo esto para lo momento que laja visible poquito laástica Mia Scroll is here, a OMG, esto es ALT man works. Y ahora, si, si, si, si, si, si, si, si, si, si, si, si, si, si, si, si, si, si, si, si, si, si, si, si, si, si, si, si, si, si, si, si, si, si, si, si, si, si, si, si, si, si, si, si, si, si, si, si, si, si, si, si, si, si, si, si, si, si, si, si, si, si, si, si, si, si, si, si, si, si, si, si, si, si, si, si, si, si, si, si, si, si, si, si, si, si, si, si, si, si, si, si, si, si, si, si, si, si, si, si, si, si, si, si, si, si, si, si, si, si, si, si, si, si, si, si, si, si, si, si, si, si, si, si, si, si, si, si, si, si, si, si, si, si, si, si, si, si, si, si, si, si, si, si, si, si, si, si, si, si, si, si, si, si, si, si, si, si, si, si, si, si, si, si, si, si, si, si, si, si, si, si, si, si, si, si, si, si, si, si, si, si, si, si, si, si, si, si, si, si, si, si, si, si, si, si, si, si, si, si, si, si, si, si, si, si, si, si, si, si, si, si, si, si, si, si, si, si, si, si, si
",kk,"{'channel_0': 'favor grave su mensaje después del tono. '},{'channel_1': '¿Cuál es el monto que. la carta de uno. Y le digo no, no se te. bautismo. '}",¿1.-Cuánto tiempo tampoco?",,
,55,1.04e+18,8E+11,3,2025/12/16 10:19,20,https://pcc-va.airudder.com/download/20251216/61d83ff66078430c8477e5db7a267f99/d92651131d824706928b78b763422808.wav,称不认识,89,,录音上没有这个录音,"通道1: Bueno Hola Miguel Guernos Para Ide gedaan NÄLJora Maldії Maldi Bueno que no tengo buい BlemС en el país. Bueno, agora tienes másarness. Y好, Principa specially la Malón y por último de que la problema ha definado zalosa pero podría再 otroó. Estbren las mujeres en su comunidad. Han situado con எனito que ammonicamenos que va aear como el que resulta el lugar en general, de que en las segregationistas no lo conozco. Sí señorita pero no lo conozco. Mándeme número de la persona que le hiciste.
通道2: Bueno, hola, buenos días, estamos localizando. ¿Qué están los señores ahí? ¿Viste a lo conoces? Ahí me... ¿Vienen a nosotros? ¿Lo conoces? ¿Cuándo se... ¿Al señor Isayas la Autista? ¿Dejó este número como referencia a un préstamo que tiene con nosotros? ¿Dejó este número como referencia principal? Perfecto, creo que le podamos pasar el número de la persona... ¿Vienen a la persona? Lo mismo. Claro, en un momento se la mando.
","根据录音正确都是对Bueno, bueno Marcial, buenas tardes, Marcial Portillo Vázquez, hablamos de Olafina, del sucesaldo pendiente de 495 pesos, porque no. Sí, hace rato me mandaron por mensaje un iban a hacer un convenio. Realicé el pago de 495 de hoy a más tardar a las 6:00 de la tarde, lo puede realizar por Space o en Seven Eleven. Muy bien, oh, sí, está bien. Bien, bien tu comprobante de pago, tienes a la cuenta para realizar este pago. Sí, se los mando, te voy a hacer llegar un WhatsApp para que por este medio me lo haga llegar. Sí, señor, de lo contrario nos vamos a comunicar con Víctor Hugo Portillo y con Tomás, tu hermano, para que ellos me lo hagan. Sí, señor, contamos con ese pago a las 6:00 de la tarde el día de hoy. Sí, señor.","{'channel_0': 'y no. bueno. mande. bueno, que no se, no tengo buena señal, dígame. bueno. Ahorita sí escucho bien, dígame. ¿A quién? Isaías. no, señorita, no, no, no, no, no lo conozco. no lo cono, sí, señorita, pero no lo conozco. eh, mándeme el número de, mándeme el número de la persona que dice usted. ok. '},{'channel_1': 'Bueno, hola, buenos días. ¿Estamos localizando? Estando el Señor Icías, ya Cristo lo conoce. I am. ¿pero a ti, nosotros lo conoces? ¿Conoce al Señor Isaías Bautista? Es que el señor dejó este número como referencia a un préstamo que tiene con nosotros. y la idea es que no. dejó este número como referencia principal. perfecto, creo que le podamos pasar el número de la de la persona para que se lo. ¿De quién es la responsabilidad? Claro, en un momento se la mando. '}","1; estamos localizando  mande, mande",,
56,56,1.04e+18,8E+11,3,2025/12/16 17:18,11,https://pcc-va.airudder.com/download/manual/6f82289989995909f44a2ef8a802b552.wav,有还款诚意,88,,录音上没有这个录音,"通道1: Bueno, estás bien. Sí, hacer. Si echaros que me mandaron por mensaje, Ah maar. ¿O si está bien? Ok, se lo mando. Si se lo mando. ¿Si se llor? ¿Si se llor? ¿Si se llor? ¿Si se llor? ¿Si se llor?
通道2: nothing. Bueno, pero. Buenas noticias. Uncle WAZ que hablamos de la final después, es algo pendiente de cuatrocientos no 25 pesos.SCW género porque no lo harás. En la perspectiva. de la ley. El pago de cuatrocientos no veis cinco. Hoy a más de algo a la seis de la tarde no puede realizar por espejio en el léven. Muy bien. Y en este momento comprobante de la tarde para realizar este pago. Si si si si te voy a hacer llegar un guasa para que por ese miren me lo agarre. De lo contrario nos vamos a comunicar con Victor Hugo Portillo y con Tomás su hermano. Para que ellos nos paguen. Contamos con ese pago la seis de la tarde.
","根据录音正确都是对Bueno, bueno Marcial, buenas tardes, Marcial Portillo Vázquez, hablamos de Olafina, del sucesaldo pendiente de 495 pesos, porque no. Sí, hace rato me mandaron por mensaje un iban a hacer un convenio. Realicé el pago de 495 de hoy a más tardar a las 6:00 de la tarde, lo puede realizar por Space o en Seven Eleven. Muy bien, oh, sí, está bien. Bien, bien tu comprobante de pago, tienes a la cuenta para realizar este pago. Sí, se los mando, te voy a hacer llegar un WhatsApp para que por este medio me lo haga llegar. Sí, señor, de lo contrario nos vamos a comunicar con Víctor Hugo Portillo y con Tomás, tu hermano, para que ellos me lo hagan. Sí, señor, contamos con ese pago a las 6:00 de la tarde el día de hoy. Sí, señor.","{'channel_0': 'sí, buenas tardes. sí, hace rato sí, hace rato me mandaron por mensaje un iban a hacer un convenio. sí está bien. ok se los mando, sí se los mando. 7시에요? sí, sí, sí, sí, sí. sí señor. '},{'channel_1': 'bueno. Miguel, hablamos de la fina del saldo pendiente de cuatrocientos noventa y cinco pesos. por qué no lo has realizado. Realicé el pago de cuatrocientos noventa y cinco pesos hoy a más tardar a las seis de la tarde. Lo puede realizar por space o en seven eleven. muy bien. ¿Ya envió su comprobante de pago? ¿Tienes a las seis de la tarde para realizar este pago? te voy a hacer llegar un whatsapp para que por este medio me lo hagas llegar. De lo contrario, nos vamos a comunicar con Victor Hugo Portillo y con Tomás, tu hermano. Para que ellos nos paguen, contamos con ese pago a las seis de la tarde de hoy. ustedes son madre. '}",1; hablamos de la fina del saldo pendiente 2; usted es su madre,,
57,57,1.04e+18,8E+11,0,2025/12/16 14:28,11,https://nxai-hk-1259196162.cos.ap-hongkong.myqcloud.com/20251217/25523/f44b72e6-4527-4390-bc24-5e4af8884cc8.mp3,有还款诚意,88,,录音上没有这个录音,"通道1: Ahora, está bien. ahí y está bien un solita que me ocupa el tren un trabajo pues voy a pedir lo voy a hacer si no me hace cuándo me tuquito pero bien lo trabajo poquito más
通道2: Bueno, bueno, estarles de diciembre, al gusto, con Lira Villegar a la ikiza Mueh. Nos comunicamos, señor, de un scissors de Holatina, el suizo, sensor financiero. Le hemos sido de llamadas para recordarle que tiene un pago pendiente de 190 pesos para que no se atrece en pago. No se atrece en sus pagos, le recomienda que lo pague el día de hoy, no puedo ser mediante la clave interbancaria, o en alguno de los establecimientos como hoy se ven el eve, forma su cuadana jara, no rirá o gualmar. Contamos con sus pagos del día de hoy, señor, mira. Muy bien, como en cuanto tiempo lo estaría de realizando. Pero como le menciono, cada vez que se atrece con sus pagos, se le estaría haciendo un cargo extra. No puedo realizar como le mientan. Muy bien, eso sería como en cuanto tiempo uno de dos horas, un poco más. Muy bien, cuando la grézco, señor Lira, por cuando se le llamaba.
","根据录音正确都是对Bueno, bueno Marcial, buenas tardes, Marcial Portillo Vázquez, hablamos de Olafina, del sucesaldo pendiente de 495 pesos, porque no. Sí, hace rato me mandaron por mensaje un iban a hacer un convenio. Realicé el pago de 495 de hoy a más tardar a las 6:00 de la tarde, lo puede realizar por Space o en Seven Eleven. Muy bien, oh, sí, está bien. Bien, bien tu comprobante de pago, tienes a la cuenta para realizar este pago. Sí, se los mando, te voy a hacer llegar un WhatsApp para que por este medio me lo haga llegar. Sí, señor, de lo contrario nos vamos a comunicar con Víctor Hugo Portillo y con Tomás, tu hermano, para que ellos me lo hagan. Sí, señor, contamos con ese pago a las 6:00 de la tarde el día de hoy. Sí, señor.","{'channel_0': 'Bueno. ¿Quién me habla. Bueno. Aba. ¿Qué tanto? Mmm. Sí, está bien. Consuelita que me ocupe de un trabajo. Sí, pues te digo, ahorita lo voy a hacer. Nomás aguanta un poquito, pero ya en el trabajo. poquito más. '},{'channel_1': 'Bueno, buenas tardes. Tengo el gusto con Nira Villegas, Alexis Samuel. nos comunicamos, señor de asesor olatina soy su asesor financiero. El motivo de la llamada es para recordarle que tiene un pago pendiente de 190 pesos. Para que no se retrase en su pago, 190 pesos. Esto es con respecto al préstamo que solicitó en la aplicación. Para que no se retrase en sus pagos, se le recomienda que lo pague el día de hoy. Lo puede hacer mediante clave interbancaria o en alguno de los establecimientos como SBNV, Forma Guadalajara, Correa o Walma. Contamos con su pago el día de hoy, señor Clia. muy bien, como en cuanto tiempo lo esperaré realizando. Pero como le mencionó, cada vez que se trase con su pago se le estaría haciendo un cargo extra. lo puede realizar como le mencione. Ah, muy bien. Eso sería como en cuanto tiempo, unas dos horas o un poco más. Ah, muy bien. Mondo, lo agradezco, señor Lira, por contestar la llamada. '}",1./ walmart  2./ holafina ,,
58,58,1.04e+18,8E+11,0,2025/12/16 12:04,12,https://nxai-hk-1259196162.cos.ap-hongkong.myqcloud.com/20251217/25523/0b62c9f5-e642-430e-8d9c-a45bab8f8e66.mp3,承诺付款,88,,录音上没有这个录音,"通道1: al marco. H�� preguntó de S May es lo mismo de qON don No lo lo voy a ver, pero ya se supongo, ¿verdad? ¿Y quieres tener una casión para suerte, Guatá? No, si no, no, si no. No, si no, no, si no. A veces quieres más, no se va a hacer. Si no, vas a ser algo que más está hablando de su marcas. Pero si quieres más o menos nuevo, no te hacía que haga costar. No, no, no, no. No, no, no. No, no, no. Railsas sí, esto está mejor.
通道2: Hola Mauricio, ¿qué es? Yo te lo logró la fina para recordarte su pago del día de hoy. El pago del día de hoy es de 1481. El pago del día de hoy es de 1481. El pago del día de hoy es de 1481. El pago del día de hoy es de 1481. El pago del día de hoy es de 1481. El pago del día de hoy es de 1481. El pago del día de hoy es de 1481. El pago del día de hoy es de 1481. El pago del día de hoy es de 1481. El pago del día de hoy es de 1481. El pago del día de hoy es de 1481. El pago del día de hoy es de 1481. El pago del día de hoy es de 1481. El pago del día de hoy es de 1481. El pago del día de hoy es de 1481. El pago del día de hoy es de 1481. El pago del día de hoy es de 1481. Ok, venga réjeνο. Ok, vetelo si se restalja. eight it no. Eh pretende que algo llega presidente. C Alecho yادad rogada. nuclear el huevo soloi showed El pago del día de hoy es de 1481. Le he slickado, pero no estárated. En algún lugar ellife sea muy popular. Con recompensados en sus plato vamos a ver.
","根据录音正确都是对Bueno, buenas tardes, tengo el gusto con Lira Villegas Alleti Samuel ¿Quién habla? Nos comunicamos de asesor, de Holatina Suiza, asesor financiero Le le pido la llamada es para recordarle que tiene un pago pendiente de 190 pesos para que no se atrase de su pago 190 pesos, esto es con respecto al préstamo que solicitó en la aplicación Para que no se trace en sus pagos, se le recomienda que lo pague el día de hoy. Lo puede hacer mediante plan interbancaria o en alguno de los cablecimientos como SBNL, Formes Guadalajara, Aurrerá o Walmart. ¿Contamos con tu pago el día de hoy señor Lira.
Sí, está bien.
Muy bien, ¿cómo en cuánto tiempo lo estaría realizando?
No es ahorita que me preocupe, estoy en un trabajo.
Pero como le menciono, cada día que se atrase con su pago se le estaría haciendo un cargo extra. ¿Lo puede realizar como le dispone?
Pues te digo, ahorita lo voy a hacer, nomás aguantame un poquito, me ayuda más abajo.
Ah, muy bien, ¿eso sería como en cuanto tiempo, unas dos horas o un poco más.
Un poquito más.
Ah, muy bien. Bueno, le agradezco señor Lira por contestar la llamada.
Cortana.","{'channel_0': 'Bien, bien. ¿En qué lugar? Y se me ha llamado de ayer y ya les confirmé que hoy le toca a mí. Hoy, pues, en el teléfono se mandó un WhatsApp a uno. de hecho me está dando. No, son cincocientos diez y cincuenta y cinco. Son los únicos dos plazos porque el otro tercero me toca hasta mañana. ¿Con cuánto de 2006? O sea que hoy voy a hacer los dos mil seis y mañana el del 20No, no tengo aquí en la aplicación. De hecho, el oro siempre me lo suspende, le han hecho mi trabajo, me cobran de comisión como 10 pesos algo así la vez pasada. Sí, eh, si quiere ese, ese es un cromo de WhatsApp, yo supongo, ¿verdad? Si quiere tener la caja de WhatsApp. A mí si quieres más, pero si quieres menos, ya te lo digo. '},{'channel_1': 'hola mauricio buenos días, te habla de yolanda  para recordarte tu pago del día de hoy. ok bueno el pago del día de hoy es de mil cuatrocientos ochenta y uno. Si, no es. ok gusta que le mande su liga de pago. Ah, bueno. Ah, ok, a poco, bueno. Este no, siquiera le mandó un WhatsApp para que me mande su comprobante de pago cuando lo haga. sí, bueno. ok bueno, muchas gracias mauricio. '}",1./ tercero 2./ yolanda ,,
59,59,1.04e+18,8E+11,0,2025/12/16 16:46,12,https://nxai-hk-1259196162.cos.ap-hongkong.myqcloud.com/20251217/25523/c8a7b0e9-073f-4fab-a4aa-f62b090ecc53.mp3,承诺付款,87,,录音上没有这个录音,"通道1: y luego a todos a las últimas cinco seis doscientos cuarenta doscientos cuarenta seis cuatro Bueno,爾pocha,鼻u Para uno� y declining Y desde que Jaldiín se psychicó un titulo ridilash消 toupbeat Jaldiín se pronuncia.遠 communicated
通道2: Bueno, hola, buenas tardes, estamos en el señor José Amres. Hola, buenas tardes, me comunico de la gran cierra o la fina. Ah, más para recordarle que he dicho que he hecho recorte. Y requerimos que el pago por un montón de 240 que ve el día de hoy. Ah, dos en 40. Sí, mira, te mando por mensaje de texto, la lia de pago va. Y ahorita en un correo no sé si dime. Ok, sí, está perfecta, no sé si va a ir a hacer esto. En efectivo transverse. Ok, sí, se los mando por correo, ¿vale? ¡Gracias, los dicen favor!
","根据录音正确都是对Bueno.
Hola Mauricio, buenos días. ¿Qué habla de Hola Pina para recordar de tu pago del día de hoy?
Mi señorita, ya me he hablado de ayer, que hoy le toca. Hoy te mandé en WhatsApp a un no te mandaron y te mandé una factura y dije ""hoy me transmite el diálogo"", de hecho me traigo.
Ok, bueno, el pago del día de hoy es de 1481.
No, son 1817 o 17, son los únicos costados porque el otro certero lo toca hasta mañana. O sea, que hoy voy a hacerlo el 2016 y mañana el mes de.
Okay, gusta que le mande su liga de pago.
No lo tengo aquí en la aplicación, de hecho en mi trabajo, me cobran de comisión como 10 pesos, algo así la vez pasada. Okay, pues bueno, si quieres ese es uno de los WhatsApp, pero yo supongo, ¿verdad? Que este WhatsApp, si quiere, si quiere, le mando un WhatsApp para que le mande su comprobante de pago cuando lo haga. Si quieres más para que WhatsApp, bueno. Okay, bueno, muchas gracias, Mauricio. Gracias igualmente."," 'Sí. Sí. de los ciento cuarenta. 240, sí. Y ya nada más bueno, bueno, también estaba terminado de comunicarme para a dónde los pago, en qué los voy a depositar. Si habrá manera de que me mandes el. El, pues si la cuenta para que lo haga yo el depósito. Claro. de ocho y media a nueve. ¿Y o sea, se va a quedar? Ya nada más, pero si me puedes apoyar con el número de cuenta para que haga yo la. Claro, Gracias. '},{'channel_1': 'Bueno, hola, buenas tardes. ¿Está con el señor José Andrés? hola, buenas tardes, me comunico de la financiera ola fina nada más para recordarle que vio su fecha de corte y requerimos que el pago por un monto de doscientos cuarenta que ve el día de hoy. ajá. En. Mira. Sí, mira, te mando por mensaje de texto la liga de pago. Y ahorita en un correo, no sé, no perdón. Esto es. ok sí está perfecta no sé si vaya a ser el. en efectivo transferente. ok sí, te los mando por correo, vale. Gracias de la vida, '}",1./ 240 doscientos cuarenta ,,
